Frame 1: 42 bytes on wire (336 bits), 42 bytes captured (336 bits) on interface docker0, id 0
    Section number: 1
    Interface id: 0 (docker0)
        Interface name: docker0
    Encapsulation type: Ethernet (1)
    Arrival Time: Nov 21, 2023 21:52:23.498168949 -03
    [Time shift for this packet: 0.000000000 seconds]
    Epoch Time: 1700614343.498168949 seconds
    [Time delta from previous captured frame: 0.000000000 seconds]
    [Time delta from previous displayed frame: 0.000000000 seconds]
    [Time since reference or first frame: 0.000000000 seconds]
    Frame Number: 1
    Frame Length: 42 bytes (336 bits)
    Capture Length: 42 bytes (336 bits)
    [Frame is marked: False]
    [Frame is ignored: False]
    [Protocols in frame: eth:ethertype:arp]
Ethernet II, Src: 02:42:ac:11:00:02 (02:42:ac:11:00:02), Dst: Broadcast (ff:ff:ff:ff:ff:ff)
    Destination: Broadcast (ff:ff:ff:ff:ff:ff)
        Address: Broadcast (ff:ff:ff:ff:ff:ff)
        .... ..1. .... .... .... .... = LG bit: Locally administered address (this is NOT the factory default)
        .... ...1 .... .... .... .... = IG bit: Group address (multicast/broadcast)
    Source: 02:42:ac:11:00:02 (02:42:ac:11:00:02)
        Address: 02:42:ac:11:00:02 (02:42:ac:11:00:02)
        .... ..1. .... .... .... .... = LG bit: Locally administered address (this is NOT the factory default)
        .... ...0 .... .... .... .... = IG bit: Individual address (unicast)
    Type: ARP (0x0806)
Address Resolution Protocol (request)
    Hardware type: Ethernet (1)
    Protocol type: IPv4 (0x0800)
    Hardware size: 6
    Protocol size: 4
    Opcode: request (1)
    Sender MAC address: 02:42:ac:11:00:02 (02:42:ac:11:00:02)
    Sender IP address: 172.17.0.2
    Target MAC address: 00:00:00_00:00:00 (00:00:00:00:00:00)
    Target IP address: 172.17.0.5

Frame 2: 42 bytes on wire (336 bits), 42 bytes captured (336 bits) on interface docker0, id 0
    Section number: 1
    Interface id: 0 (docker0)
        Interface name: docker0
    Encapsulation type: Ethernet (1)
    Arrival Time: Nov 21, 2023 21:52:23.498199667 -03
    [Time shift for this packet: 0.000000000 seconds]
    Epoch Time: 1700614343.498199667 seconds
    [Time delta from previous captured frame: 0.000030718 seconds]
    [Time delta from previous displayed frame: 0.000030718 seconds]
    [Time since reference or first frame: 0.000030718 seconds]
    Frame Number: 2
    Frame Length: 42 bytes (336 bits)
    Capture Length: 42 bytes (336 bits)
    [Frame is marked: False]
    [Frame is ignored: False]
    [Protocols in frame: eth:ethertype:arp]
Ethernet II, Src: 02:42:ac:11:00:05 (02:42:ac:11:00:05), Dst: 02:42:ac:11:00:02 (02:42:ac:11:00:02)
    Destination: 02:42:ac:11:00:02 (02:42:ac:11:00:02)
        Address: 02:42:ac:11:00:02 (02:42:ac:11:00:02)
        .... ..1. .... .... .... .... = LG bit: Locally administered address (this is NOT the factory default)
        .... ...0 .... .... .... .... = IG bit: Individual address (unicast)
    Source: 02:42:ac:11:00:05 (02:42:ac:11:00:05)
        Address: 02:42:ac:11:00:05 (02:42:ac:11:00:05)
        .... ..1. .... .... .... .... = LG bit: Locally administered address (this is NOT the factory default)
        .... ...0 .... .... .... .... = IG bit: Individual address (unicast)
    Type: ARP (0x0806)
Address Resolution Protocol (reply)
    Hardware type: Ethernet (1)
    Protocol type: IPv4 (0x0800)
    Hardware size: 6
    Protocol size: 4
    Opcode: reply (2)
    Sender MAC address: 02:42:ac:11:00:05 (02:42:ac:11:00:05)
    Sender IP address: 172.17.0.5
    Target MAC address: 02:42:ac:11:00:02 (02:42:ac:11:00:02)
    Target IP address: 172.17.0.2

Frame 3: 74 bytes on wire (592 bits), 74 bytes captured (592 bits) on interface docker0, id 0
    Section number: 1
    Interface id: 0 (docker0)
        Interface name: docker0
    Encapsulation type: Ethernet (1)
    Arrival Time: Nov 21, 2023 21:52:23.498245060 -03
    [Time shift for this packet: 0.000000000 seconds]
    Epoch Time: 1700614343.498245060 seconds
    [Time delta from previous captured frame: 0.000045393 seconds]
    [Time delta from previous displayed frame: 0.000045393 seconds]
    [Time since reference or first frame: 0.000076111 seconds]
    Frame Number: 3
    Frame Length: 74 bytes (592 bits)
    Capture Length: 74 bytes (592 bits)
    [Frame is marked: False]
    [Frame is ignored: False]
    [Protocols in frame: eth:ethertype:ip:tcp]
Ethernet II, Src: 02:42:ac:11:00:02 (02:42:ac:11:00:02), Dst: 02:42:ac:11:00:05 (02:42:ac:11:00:05)
    Destination: 02:42:ac:11:00:05 (02:42:ac:11:00:05)
        Address: 02:42:ac:11:00:05 (02:42:ac:11:00:05)
        .... ..1. .... .... .... .... = LG bit: Locally administered address (this is NOT the factory default)
        .... ...0 .... .... .... .... = IG bit: Individual address (unicast)
    Source: 02:42:ac:11:00:02 (02:42:ac:11:00:02)
        Address: 02:42:ac:11:00:02 (02:42:ac:11:00:02)
        .... ..1. .... .... .... .... = LG bit: Locally administered address (this is NOT the factory default)
        .... ...0 .... .... .... .... = IG bit: Individual address (unicast)
    Type: IPv4 (0x0800)
Internet Protocol Version 4, Src: 172.17.0.2, Dst: 172.17.0.5
    0100 .... = Version: 4
    .... 0101 = Header Length: 20 bytes (5)
    Differentiated Services Field: 0x00 (DSCP: CS0, ECN: Not-ECT)
        0000 00.. = Differentiated Services Codepoint: Default (0)
        .... ..00 = Explicit Congestion Notification: Not ECN-Capable Transport (0)
    Total Length: 60
    Identification: 0x2110 (8464)
    010. .... = Flags: 0x2, Don't fragment
        0... .... = Reserved bit: Not set
        .1.. .... = Don't fragment: Set
        ..0. .... = More fragments: Not set
    ...0 0000 0000 0000 = Fragment Offset: 0
    Time to Live: 64
    Protocol: TCP (6)
    Header Checksum: 0xc182 [validation disabled]
    [Header checksum status: Unverified]
    Source Address: 172.17.0.2
    Destination Address: 172.17.0.5
Transmission Control Protocol, Src Port: 52388, Dst Port: 22, Seq: 0, Len: 0
    Source Port: 52388
    Destination Port: 22
    [Stream index: 0]
    [Conversation completeness: Incomplete (0)]
    [TCP Segment Len: 0]
    Sequence Number: 0    (relative sequence number)
    Sequence Number (raw): 200777089
    [Next Sequence Number: 1    (relative sequence number)]
    Acknowledgment Number: 0
    Acknowledgment number (raw): 0
    1010 .... = Header Length: 40 bytes (10)
    Flags: 0x002 (SYN)
        000. .... .... = Reserved: Not set
        ...0 .... .... = Accurate ECN: Not set
        .... 0... .... = Congestion Window Reduced: Not set
        .... .0.. .... = ECN-Echo: Not set
        .... ..0. .... = Urgent: Not set
        .... ...0 .... = Acknowledgment: Not set
        .... .... 0... = Push: Not set
        .... .... .0.. = Reset: Not set
        .... .... ..1. = Syn: Set
            [Expert Info (Chat/Sequence): Connection establish request (SYN): server port 22]
                [Connection establish request (SYN): server port 22]
                [Severity level: Chat]
                [Group: Sequence]
        .... .... ...0 = Fin: Not set
        [TCP Flags: ··········S·]
    Window: 64240
    [Calculated window size: 64240]
    Checksum: 0x5858 [unverified]
    [Checksum Status: Unverified]
    Urgent Pointer: 0
    Options: (20 bytes), Maximum segment size, SACK permitted, Timestamps, No-Operation (NOP), Window scale
        TCP Option - Maximum segment size: 1460 bytes
            Kind: Maximum Segment Size (2)
            Length: 4
            MSS Value: 1460
        TCP Option - SACK permitted
            Kind: SACK Permitted (4)
            Length: 2
        TCP Option - Timestamps
            Kind: Time Stamp Option (8)
            Length: 10
            Timestamp value: 1233745078: TSval 1233745078, TSecr 0
            Timestamp echo reply: 0
        TCP Option - No-Operation (NOP)
            Kind: No-Operation (1)
        TCP Option - Window scale: 7 (multiply by 128)
            Kind: Window Scale (3)
            Length: 3
            Shift count: 7
            [Multiplier: 128]
    [Timestamps]
        [Time since first frame in this TCP stream: 0.000000000 seconds]
        [Time since previous frame in this TCP stream: 0.000000000 seconds]

Frame 4: 74 bytes on wire (592 bits), 74 bytes captured (592 bits) on interface docker0, id 0
    Section number: 1
    Interface id: 0 (docker0)
        Interface name: docker0
    Encapsulation type: Ethernet (1)
    Arrival Time: Nov 21, 2023 21:52:23.498263504 -03
    [Time shift for this packet: 0.000000000 seconds]
    Epoch Time: 1700614343.498263504 seconds
    [Time delta from previous captured frame: 0.000018444 seconds]
    [Time delta from previous displayed frame: 0.000018444 seconds]
    [Time since reference or first frame: 0.000094555 seconds]
    Frame Number: 4
    Frame Length: 74 bytes (592 bits)
    Capture Length: 74 bytes (592 bits)
    [Frame is marked: False]
    [Frame is ignored: False]
    [Protocols in frame: eth:ethertype:ip:tcp]
Ethernet II, Src: 02:42:ac:11:00:05 (02:42:ac:11:00:05), Dst: 02:42:ac:11:00:02 (02:42:ac:11:00:02)
    Destination: 02:42:ac:11:00:02 (02:42:ac:11:00:02)
        Address: 02:42:ac:11:00:02 (02:42:ac:11:00:02)
        .... ..1. .... .... .... .... = LG bit: Locally administered address (this is NOT the factory default)
        .... ...0 .... .... .... .... = IG bit: Individual address (unicast)
    Source: 02:42:ac:11:00:05 (02:42:ac:11:00:05)
        Address: 02:42:ac:11:00:05 (02:42:ac:11:00:05)
        .... ..1. .... .... .... .... = LG bit: Locally administered address (this is NOT the factory default)
        .... ...0 .... .... .... .... = IG bit: Individual address (unicast)
    Type: IPv4 (0x0800)
Internet Protocol Version 4, Src: 172.17.0.5, Dst: 172.17.0.2
    0100 .... = Version: 4
    .... 0101 = Header Length: 20 bytes (5)
    Differentiated Services Field: 0x00 (DSCP: CS0, ECN: Not-ECT)
        0000 00.. = Differentiated Services Codepoint: Default (0)
        .... ..00 = Explicit Congestion Notification: Not ECN-Capable Transport (0)
    Total Length: 60
    Identification: 0x0000 (0)
    010. .... = Flags: 0x2, Don't fragment
        0... .... = Reserved bit: Not set
        .1.. .... = Don't fragment: Set
        ..0. .... = More fragments: Not set
    ...0 0000 0000 0000 = Fragment Offset: 0
    Time to Live: 64
    Protocol: TCP (6)
    Header Checksum: 0xe292 [validation disabled]
    [Header checksum status: Unverified]
    Source Address: 172.17.0.5
    Destination Address: 172.17.0.2
Transmission Control Protocol, Src Port: 22, Dst Port: 52388, Seq: 0, Ack: 1, Len: 0
    Source Port: 22
    Destination Port: 52388
    [Stream index: 0]
    [Conversation completeness: Incomplete, SYN_SENT (1)]
    [TCP Segment Len: 0]
    Sequence Number: 0    (relative sequence number)
    Sequence Number (raw): 3572532555
    [Next Sequence Number: 1    (relative sequence number)]
    Acknowledgment Number: 1    (relative ack number)
    Acknowledgment number (raw): 200777090
    1010 .... = Header Length: 40 bytes (10)
    Flags: 0x012 (SYN, ACK)
        000. .... .... = Reserved: Not set
        ...0 .... .... = Accurate ECN: Not set
        .... 0... .... = Congestion Window Reduced: Not set
        .... .0.. .... = ECN-Echo: Not set
        .... ..0. .... = Urgent: Not set
        .... ...1 .... = Acknowledgment: Set
        .... .... 0... = Push: Not set
        .... .... .0.. = Reset: Not set
        .... .... ..1. = Syn: Set
            [Expert Info (Chat/Sequence): Connection establish acknowledge (SYN+ACK): server port 22]
                [Connection establish acknowledge (SYN+ACK): server port 22]
                [Severity level: Chat]
                [Group: Sequence]
        .... .... ...0 = Fin: Not set
        [TCP Flags: ·······A··S·]
    Window: 65160
    [Calculated window size: 65160]
    Checksum: 0x5858 [unverified]
    [Checksum Status: Unverified]
    Urgent Pointer: 0
    Options: (20 bytes), Maximum segment size, SACK permitted, Timestamps, No-Operation (NOP), Window scale
        TCP Option - Maximum segment size: 1460 bytes
            Kind: Maximum Segment Size (2)
            Length: 4
            MSS Value: 1460
        TCP Option - SACK permitted
            Kind: SACK Permitted (4)
            Length: 2
        TCP Option - Timestamps
            Kind: Time Stamp Option (8)
            Length: 10
            Timestamp value: 3458410066: TSval 3458410066, TSecr 1233745078
            Timestamp echo reply: 1233745078
        TCP Option - No-Operation (NOP)
            Kind: No-Operation (1)
        TCP Option - Window scale: 7 (multiply by 128)
            Kind: Window Scale (3)
            Length: 3
            Shift count: 7
            [Multiplier: 128]
    [Timestamps]
        [Time since first frame in this TCP stream: 0.000018444 seconds]
        [Time since previous frame in this TCP stream: 0.000018444 seconds]
    [SEQ/ACK analysis]
        [This is an ACK to the segment in frame: 3]
        [The RTT to ACK the segment was: 0.000018444 seconds]

Frame 5: 66 bytes on wire (528 bits), 66 bytes captured (528 bits) on interface docker0, id 0
    Section number: 1
    Interface id: 0 (docker0)
        Interface name: docker0
    Encapsulation type: Ethernet (1)
    Arrival Time: Nov 21, 2023 21:52:23.498276958 -03
    [Time shift for this packet: 0.000000000 seconds]
    Epoch Time: 1700614343.498276958 seconds
    [Time delta from previous captured frame: 0.000013454 seconds]
    [Time delta from previous displayed frame: 0.000013454 seconds]
    [Time since reference or first frame: 0.000108009 seconds]
    Frame Number: 5
    Frame Length: 66 bytes (528 bits)
    Capture Length: 66 bytes (528 bits)
    [Frame is marked: False]
    [Frame is ignored: False]
    [Protocols in frame: eth:ethertype:ip:tcp]
Ethernet II, Src: 02:42:ac:11:00:02 (02:42:ac:11:00:02), Dst: 02:42:ac:11:00:05 (02:42:ac:11:00:05)
    Destination: 02:42:ac:11:00:05 (02:42:ac:11:00:05)
        Address: 02:42:ac:11:00:05 (02:42:ac:11:00:05)
        .... ..1. .... .... .... .... = LG bit: Locally administered address (this is NOT the factory default)
        .... ...0 .... .... .... .... = IG bit: Individual address (unicast)
    Source: 02:42:ac:11:00:02 (02:42:ac:11:00:02)
        Address: 02:42:ac:11:00:02 (02:42:ac:11:00:02)
        .... ..1. .... .... .... .... = LG bit: Locally administered address (this is NOT the factory default)
        .... ...0 .... .... .... .... = IG bit: Individual address (unicast)
    Type: IPv4 (0x0800)
Internet Protocol Version 4, Src: 172.17.0.2, Dst: 172.17.0.5
    0100 .... = Version: 4
    .... 0101 = Header Length: 20 bytes (5)
    Differentiated Services Field: 0x00 (DSCP: CS0, ECN: Not-ECT)
        0000 00.. = Differentiated Services Codepoint: Default (0)
        .... ..00 = Explicit Congestion Notification: Not ECN-Capable Transport (0)
    Total Length: 52
    Identification: 0x2111 (8465)
    010. .... = Flags: 0x2, Don't fragment
        0... .... = Reserved bit: Not set
        .1.. .... = Don't fragment: Set
        ..0. .... = More fragments: Not set
    ...0 0000 0000 0000 = Fragment Offset: 0
    Time to Live: 64
    Protocol: TCP (6)
    Header Checksum: 0xc189 [validation disabled]
    [Header checksum status: Unverified]
    Source Address: 172.17.0.2
    Destination Address: 172.17.0.5
Transmission Control Protocol, Src Port: 52388, Dst Port: 22, Seq: 1, Ack: 1, Len: 0
    Source Port: 52388
    Destination Port: 22
    [Stream index: 0]
    [Conversation completeness: Incomplete, CLIENT_ESTABLISHED (3)]
    [TCP Segment Len: 0]
    Sequence Number: 1    (relative sequence number)
    Sequence Number (raw): 200777090
    [Next Sequence Number: 1    (relative sequence number)]
    Acknowledgment Number: 1    (relative ack number)
    Acknowledgment number (raw): 3572532556
    1000 .... = Header Length: 32 bytes (8)
    Flags: 0x010 (ACK)
        000. .... .... = Reserved: Not set
        ...0 .... .... = Accurate ECN: Not set
        .... 0... .... = Congestion Window Reduced: Not set
        .... .0.. .... = ECN-Echo: Not set
        .... ..0. .... = Urgent: Not set
        .... ...1 .... = Acknowledgment: Set
        .... .... 0... = Push: Not set
        .... .... .0.. = Reset: Not set
        .... .... ..0. = Syn: Not set
        .... .... ...0 = Fin: Not set
        [TCP Flags: ·······A····]
    Window: 502
    [Calculated window size: 64256]
    [Window size scaling factor: 128]
    Checksum: 0x5850 [unverified]
    [Checksum Status: Unverified]
    Urgent Pointer: 0
    Options: (12 bytes), No-Operation (NOP), No-Operation (NOP), Timestamps
        TCP Option - No-Operation (NOP)
            Kind: No-Operation (1)
        TCP Option - No-Operation (NOP)
            Kind: No-Operation (1)
        TCP Option - Timestamps
            Kind: Time Stamp Option (8)
            Length: 10
            Timestamp value: 1233745078: TSval 1233745078, TSecr 3458410066
            Timestamp echo reply: 3458410066
    [Timestamps]
        [Time since first frame in this TCP stream: 0.000031898 seconds]
        [Time since previous frame in this TCP stream: 0.000013454 seconds]
    [SEQ/ACK analysis]
        [This is an ACK to the segment in frame: 4]
        [The RTT to ACK the segment was: 0.000013454 seconds]
        [iRTT: 0.000031898 seconds]

Frame 6: 100 bytes on wire (800 bits), 100 bytes captured (800 bits) on interface docker0, id 0
    Section number: 1
    Interface id: 0 (docker0)
        Interface name: docker0
    Encapsulation type: Ethernet (1)
    Arrival Time: Nov 21, 2023 21:52:23.498763308 -03
    [Time shift for this packet: 0.000000000 seconds]
    Epoch Time: 1700614343.498763308 seconds
    [Time delta from previous captured frame: 0.000486350 seconds]
    [Time delta from previous displayed frame: 0.000486350 seconds]
    [Time since reference or first frame: 0.000594359 seconds]
    Frame Number: 6
    Frame Length: 100 bytes (800 bits)
    Capture Length: 100 bytes (800 bits)
    [Frame is marked: False]
    [Frame is ignored: False]
    [Protocols in frame: eth:ethertype:ip:tcp:ssh]
Ethernet II, Src: 02:42:ac:11:00:02 (02:42:ac:11:00:02), Dst: 02:42:ac:11:00:05 (02:42:ac:11:00:05)
    Destination: 02:42:ac:11:00:05 (02:42:ac:11:00:05)
        Address: 02:42:ac:11:00:05 (02:42:ac:11:00:05)
        .... ..1. .... .... .... .... = LG bit: Locally administered address (this is NOT the factory default)
        .... ...0 .... .... .... .... = IG bit: Individual address (unicast)
    Source: 02:42:ac:11:00:02 (02:42:ac:11:00:02)
        Address: 02:42:ac:11:00:02 (02:42:ac:11:00:02)
        .... ..1. .... .... .... .... = LG bit: Locally administered address (this is NOT the factory default)
        .... ...0 .... .... .... .... = IG bit: Individual address (unicast)
    Type: IPv4 (0x0800)
Internet Protocol Version 4, Src: 172.17.0.2, Dst: 172.17.0.5
    0100 .... = Version: 4
    .... 0101 = Header Length: 20 bytes (5)
    Differentiated Services Field: 0x00 (DSCP: CS0, ECN: Not-ECT)
        0000 00.. = Differentiated Services Codepoint: Default (0)
        .... ..00 = Explicit Congestion Notification: Not ECN-Capable Transport (0)
    Total Length: 86
    Identification: 0x2112 (8466)
    010. .... = Flags: 0x2, Don't fragment
        0... .... = Reserved bit: Not set
        .1.. .... = Don't fragment: Set
        ..0. .... = More fragments: Not set
    ...0 0000 0000 0000 = Fragment Offset: 0
    Time to Live: 64
    Protocol: TCP (6)
    Header Checksum: 0xc166 [validation disabled]
    [Header checksum status: Unverified]
    Source Address: 172.17.0.2
    Destination Address: 172.17.0.5
Transmission Control Protocol, Src Port: 52388, Dst Port: 22, Seq: 1, Ack: 1, Len: 34
    Source Port: 52388
    Destination Port: 22
    [Stream index: 0]
    [Conversation completeness: Incomplete, ESTABLISHED (7)]
    [TCP Segment Len: 34]
    Sequence Number: 1    (relative sequence number)
    Sequence Number (raw): 200777090
    [Next Sequence Number: 35    (relative sequence number)]
    Acknowledgment Number: 1    (relative ack number)
    Acknowledgment number (raw): 3572532556
    1000 .... = Header Length: 32 bytes (8)
    Flags: 0x018 (PSH, ACK)
        000. .... .... = Reserved: Not set
        ...0 .... .... = Accurate ECN: Not set
        .... 0... .... = Congestion Window Reduced: Not set
        .... .0.. .... = ECN-Echo: Not set
        .... ..0. .... = Urgent: Not set
        .... ...1 .... = Acknowledgment: Set
        .... .... 1... = Push: Set
        .... .... .0.. = Reset: Not set
        .... .... ..0. = Syn: Not set
        .... .... ...0 = Fin: Not set
        [TCP Flags: ·······AP···]
    Window: 502
    [Calculated window size: 64256]
    [Window size scaling factor: 128]
    Checksum: 0x5872 [unverified]
    [Checksum Status: Unverified]
    Urgent Pointer: 0
    Options: (12 bytes), No-Operation (NOP), No-Operation (NOP), Timestamps
        TCP Option - No-Operation (NOP)
            Kind: No-Operation (1)
        TCP Option - No-Operation (NOP)
            Kind: No-Operation (1)
        TCP Option - Timestamps
            Kind: Time Stamp Option (8)
            Length: 10
            Timestamp value: 1233745078: TSval 1233745078, TSecr 3458410066
            Timestamp echo reply: 3458410066
    [Timestamps]
        [Time since first frame in this TCP stream: 0.000518248 seconds]
        [Time since previous frame in this TCP stream: 0.000486350 seconds]
    [SEQ/ACK analysis]
        [iRTT: 0.000031898 seconds]
        [Bytes in flight: 34]
        [Bytes sent since last PSH flag: 34]
    TCP payload (34 bytes)
SSH Protocol
    Protocol: SSH-2.0-OpenSSH_6.6.1p1 Ubuntu-8
    [Direction: client-to-server]

Frame 7: 66 bytes on wire (528 bits), 66 bytes captured (528 bits) on interface docker0, id 0
    Section number: 1
    Interface id: 0 (docker0)
        Interface name: docker0
    Encapsulation type: Ethernet (1)
    Arrival Time: Nov 21, 2023 21:52:23.498773783 -03
    [Time shift for this packet: 0.000000000 seconds]
    Epoch Time: 1700614343.498773783 seconds
    [Time delta from previous captured frame: 0.000010475 seconds]
    [Time delta from previous displayed frame: 0.000010475 seconds]
    [Time since reference or first frame: 0.000604834 seconds]
    Frame Number: 7
    Frame Length: 66 bytes (528 bits)
    Capture Length: 66 bytes (528 bits)
    [Frame is marked: False]
    [Frame is ignored: False]
    [Protocols in frame: eth:ethertype:ip:tcp]
Ethernet II, Src: 02:42:ac:11:00:05 (02:42:ac:11:00:05), Dst: 02:42:ac:11:00:02 (02:42:ac:11:00:02)
    Destination: 02:42:ac:11:00:02 (02:42:ac:11:00:02)
        Address: 02:42:ac:11:00:02 (02:42:ac:11:00:02)
        .... ..1. .... .... .... .... = LG bit: Locally administered address (this is NOT the factory default)
        .... ...0 .... .... .... .... = IG bit: Individual address (unicast)
    Source: 02:42:ac:11:00:05 (02:42:ac:11:00:05)
        Address: 02:42:ac:11:00:05 (02:42:ac:11:00:05)
        .... ..1. .... .... .... .... = LG bit: Locally administered address (this is NOT the factory default)
        .... ...0 .... .... .... .... = IG bit: Individual address (unicast)
    Type: IPv4 (0x0800)
Internet Protocol Version 4, Src: 172.17.0.5, Dst: 172.17.0.2
    0100 .... = Version: 4
    .... 0101 = Header Length: 20 bytes (5)
    Differentiated Services Field: 0x00 (DSCP: CS0, ECN: Not-ECT)
        0000 00.. = Differentiated Services Codepoint: Default (0)
        .... ..00 = Explicit Congestion Notification: Not ECN-Capable Transport (0)
    Total Length: 52
    Identification: 0x72e3 (29411)
    010. .... = Flags: 0x2, Don't fragment
        0... .... = Reserved bit: Not set
        .1.. .... = Don't fragment: Set
        ..0. .... = More fragments: Not set
    ...0 0000 0000 0000 = Fragment Offset: 0
    Time to Live: 64
    Protocol: TCP (6)
    Header Checksum: 0x6fb7 [validation disabled]
    [Header checksum status: Unverified]
    Source Address: 172.17.0.5
    Destination Address: 172.17.0.2
Transmission Control Protocol, Src Port: 22, Dst Port: 52388, Seq: 1, Ack: 35, Len: 0
    Source Port: 22
    Destination Port: 52388
    [Stream index: 0]
    [Conversation completeness: Incomplete, DATA (15)]
    [TCP Segment Len: 0]
    Sequence Number: 1    (relative sequence number)
    Sequence Number (raw): 3572532556
    [Next Sequence Number: 1    (relative sequence number)]
    Acknowledgment Number: 35    (relative ack number)
    Acknowledgment number (raw): 200777124
    1000 .... = Header Length: 32 bytes (8)
    Flags: 0x010 (ACK)
        000. .... .... = Reserved: Not set
        ...0 .... .... = Accurate ECN: Not set
        .... 0... .... = Congestion Window Reduced: Not set
        .... .0.. .... = ECN-Echo: Not set
        .... ..0. .... = Urgent: Not set
        .... ...1 .... = Acknowledgment: Set
        .... .... 0... = Push: Not set
        .... .... .0.. = Reset: Not set
        .... .... ..0. = Syn: Not set
        .... .... ...0 = Fin: Not set
        [TCP Flags: ·······A····]
    Window: 509
    [Calculated window size: 65152]
    [Window size scaling factor: 128]
    Checksum: 0x5850 [unverified]
    [Checksum Status: Unverified]
    Urgent Pointer: 0
    Options: (12 bytes), No-Operation (NOP), No-Operation (NOP), Timestamps
        TCP Option - No-Operation (NOP)
            Kind: No-Operation (1)
        TCP Option - No-Operation (NOP)
            Kind: No-Operation (1)
        TCP Option - Timestamps
            Kind: Time Stamp Option (8)
            Length: 10
            Timestamp value: 3458410066: TSval 3458410066, TSecr 1233745078
            Timestamp echo reply: 1233745078
    [Timestamps]
        [Time since first frame in this TCP stream: 0.000528723 seconds]
        [Time since previous frame in this TCP stream: 0.000010475 seconds]
    [SEQ/ACK analysis]
        [This is an ACK to the segment in frame: 6]
        [The RTT to ACK the segment was: 0.000010475 seconds]
        [iRTT: 0.000031898 seconds]

Frame 8: 107 bytes on wire (856 bits), 107 bytes captured (856 bits) on interface docker0, id 0
    Section number: 1
    Interface id: 0 (docker0)
        Interface name: docker0
    Encapsulation type: Ethernet (1)
    Arrival Time: Nov 21, 2023 21:52:23.508799285 -03
    [Time shift for this packet: 0.000000000 seconds]
    Epoch Time: 1700614343.508799285 seconds
    [Time delta from previous captured frame: 0.010025502 seconds]
    [Time delta from previous displayed frame: 0.010025502 seconds]
    [Time since reference or first frame: 0.010630336 seconds]
    Frame Number: 8
    Frame Length: 107 bytes (856 bits)
    Capture Length: 107 bytes (856 bits)
    [Frame is marked: False]
    [Frame is ignored: False]
    [Protocols in frame: eth:ethertype:ip:tcp:ssh]
Ethernet II, Src: 02:42:ac:11:00:05 (02:42:ac:11:00:05), Dst: 02:42:ac:11:00:02 (02:42:ac:11:00:02)
    Destination: 02:42:ac:11:00:02 (02:42:ac:11:00:02)
        Address: 02:42:ac:11:00:02 (02:42:ac:11:00:02)
        .... ..1. .... .... .... .... = LG bit: Locally administered address (this is NOT the factory default)
        .... ...0 .... .... .... .... = IG bit: Individual address (unicast)
    Source: 02:42:ac:11:00:05 (02:42:ac:11:00:05)
        Address: 02:42:ac:11:00:05 (02:42:ac:11:00:05)
        .... ..1. .... .... .... .... = LG bit: Locally administered address (this is NOT the factory default)
        .... ...0 .... .... .... .... = IG bit: Individual address (unicast)
    Type: IPv4 (0x0800)
Internet Protocol Version 4, Src: 172.17.0.5, Dst: 172.17.0.2
    0100 .... = Version: 4
    .... 0101 = Header Length: 20 bytes (5)
    Differentiated Services Field: 0x00 (DSCP: CS0, ECN: Not-ECT)
        0000 00.. = Differentiated Services Codepoint: Default (0)
        .... ..00 = Explicit Congestion Notification: Not ECN-Capable Transport (0)
    Total Length: 93
    Identification: 0x72e4 (29412)
    010. .... = Flags: 0x2, Don't fragment
        0... .... = Reserved bit: Not set
        .1.. .... = Don't fragment: Set
        ..0. .... = More fragments: Not set
    ...0 0000 0000 0000 = Fragment Offset: 0
    Time to Live: 64
    Protocol: TCP (6)
    Header Checksum: 0x6f8d [validation disabled]
    [Header checksum status: Unverified]
    Source Address: 172.17.0.5
    Destination Address: 172.17.0.2
Transmission Control Protocol, Src Port: 22, Dst Port: 52388, Seq: 1, Ack: 35, Len: 41
    Source Port: 22
    Destination Port: 52388
    [Stream index: 0]
    [Conversation completeness: Incomplete, DATA (15)]
    [TCP Segment Len: 41]
    Sequence Number: 1    (relative sequence number)
    Sequence Number (raw): 3572532556
    [Next Sequence Number: 42    (relative sequence number)]
    Acknowledgment Number: 35    (relative ack number)
    Acknowledgment number (raw): 200777124
    1000 .... = Header Length: 32 bytes (8)
    Flags: 0x018 (PSH, ACK)
        000. .... .... = Reserved: Not set
        ...0 .... .... = Accurate ECN: Not set
        .... 0... .... = Congestion Window Reduced: Not set
        .... .0.. .... = ECN-Echo: Not set
        .... ..0. .... = Urgent: Not set
        .... ...1 .... = Acknowledgment: Set
        .... .... 1... = Push: Set
        .... .... .0.. = Reset: Not set
        .... .... ..0. = Syn: Not set
        .... .... ...0 = Fin: Not set
        [TCP Flags: ·······AP···]
    Window: 509
    [Calculated window size: 65152]
    [Window size scaling factor: 128]
    Checksum: 0x5879 [unverified]
    [Checksum Status: Unverified]
    Urgent Pointer: 0
    Options: (12 bytes), No-Operation (NOP), No-Operation (NOP), Timestamps
        TCP Option - No-Operation (NOP)
            Kind: No-Operation (1)
        TCP Option - No-Operation (NOP)
            Kind: No-Operation (1)
        TCP Option - Timestamps
            Kind: Time Stamp Option (8)
            Length: 10
            Timestamp value: 3458410076: TSval 3458410076, TSecr 1233745078
            Timestamp echo reply: 1233745078
    [Timestamps]
        [Time since first frame in this TCP stream: 0.010554225 seconds]
        [Time since previous frame in this TCP stream: 0.010025502 seconds]
    [SEQ/ACK analysis]
        [iRTT: 0.000031898 seconds]
        [Bytes in flight: 41]
        [Bytes sent since last PSH flag: 41]
    TCP payload (41 bytes)
SSH Protocol
    Protocol: SSH-2.0-OpenSSH_8.3p1 Ubuntu-1ubuntu0.1
    [Direction: server-to-client]

Frame 9: 66 bytes on wire (528 bits), 66 bytes captured (528 bits) on interface docker0, id 0
    Section number: 1
    Interface id: 0 (docker0)
        Interface name: docker0
    Encapsulation type: Ethernet (1)
    Arrival Time: Nov 21, 2023 21:52:23.508871695 -03
    [Time shift for this packet: 0.000000000 seconds]
    Epoch Time: 1700614343.508871695 seconds
    [Time delta from previous captured frame: 0.000072410 seconds]
    [Time delta from previous displayed frame: 0.000072410 seconds]
    [Time since reference or first frame: 0.010702746 seconds]
    Frame Number: 9
    Frame Length: 66 bytes (528 bits)
    Capture Length: 66 bytes (528 bits)
    [Frame is marked: False]
    [Frame is ignored: False]
    [Protocols in frame: eth:ethertype:ip:tcp]
Ethernet II, Src: 02:42:ac:11:00:02 (02:42:ac:11:00:02), Dst: 02:42:ac:11:00:05 (02:42:ac:11:00:05)
    Destination: 02:42:ac:11:00:05 (02:42:ac:11:00:05)
        Address: 02:42:ac:11:00:05 (02:42:ac:11:00:05)
        .... ..1. .... .... .... .... = LG bit: Locally administered address (this is NOT the factory default)
        .... ...0 .... .... .... .... = IG bit: Individual address (unicast)
    Source: 02:42:ac:11:00:02 (02:42:ac:11:00:02)
        Address: 02:42:ac:11:00:02 (02:42:ac:11:00:02)
        .... ..1. .... .... .... .... = LG bit: Locally administered address (this is NOT the factory default)
        .... ...0 .... .... .... .... = IG bit: Individual address (unicast)
    Type: IPv4 (0x0800)
Internet Protocol Version 4, Src: 172.17.0.2, Dst: 172.17.0.5
    0100 .... = Version: 4
    .... 0101 = Header Length: 20 bytes (5)
    Differentiated Services Field: 0x00 (DSCP: CS0, ECN: Not-ECT)
        0000 00.. = Differentiated Services Codepoint: Default (0)
        .... ..00 = Explicit Congestion Notification: Not ECN-Capable Transport (0)
    Total Length: 52
    Identification: 0x2113 (8467)
    010. .... = Flags: 0x2, Don't fragment
        0... .... = Reserved bit: Not set
        .1.. .... = Don't fragment: Set
        ..0. .... = More fragments: Not set
    ...0 0000 0000 0000 = Fragment Offset: 0
    Time to Live: 64
    Protocol: TCP (6)
    Header Checksum: 0xc187 [validation disabled]
    [Header checksum status: Unverified]
    Source Address: 172.17.0.2
    Destination Address: 172.17.0.5
Transmission Control Protocol, Src Port: 52388, Dst Port: 22, Seq: 35, Ack: 42, Len: 0
    Source Port: 52388
    Destination Port: 22
    [Stream index: 0]
    [Conversation completeness: Incomplete, DATA (15)]
    [TCP Segment Len: 0]
    Sequence Number: 35    (relative sequence number)
    Sequence Number (raw): 200777124
    [Next Sequence Number: 35    (relative sequence number)]
    Acknowledgment Number: 42    (relative ack number)
    Acknowledgment number (raw): 3572532597
    1000 .... = Header Length: 32 bytes (8)
    Flags: 0x010 (ACK)
        000. .... .... = Reserved: Not set
        ...0 .... .... = Accurate ECN: Not set
        .... 0... .... = Congestion Window Reduced: Not set
        .... .0.. .... = ECN-Echo: Not set
        .... ..0. .... = Urgent: Not set
        .... ...1 .... = Acknowledgment: Set
        .... .... 0... = Push: Not set
        .... .... .0.. = Reset: Not set
        .... .... ..0. = Syn: Not set
        .... .... ...0 = Fin: Not set
        [TCP Flags: ·······A····]
    Window: 502
    [Calculated window size: 64256]
    [Window size scaling factor: 128]
    Checksum: 0x5850 [unverified]
    [Checksum Status: Unverified]
    Urgent Pointer: 0
    Options: (12 bytes), No-Operation (NOP), No-Operation (NOP), Timestamps
        TCP Option - No-Operation (NOP)
            Kind: No-Operation (1)
        TCP Option - No-Operation (NOP)
            Kind: No-Operation (1)
        TCP Option - Timestamps
            Kind: Time Stamp Option (8)
            Length: 10
            Timestamp value: 1233745088: TSval 1233745088, TSecr 3458410076
            Timestamp echo reply: 3458410076
    [Timestamps]
        [Time since first frame in this TCP stream: 0.010626635 seconds]
        [Time since previous frame in this TCP stream: 0.000072410 seconds]
    [SEQ/ACK analysis]
        [This is an ACK to the segment in frame: 8]
        [The RTT to ACK the segment was: 0.000072410 seconds]
        [iRTT: 0.000031898 seconds]

Frame 10: 2034 bytes on wire (16272 bits), 2034 bytes captured (16272 bits) on interface docker0, id 0
    Section number: 1
    Interface id: 0 (docker0)
        Interface name: docker0
    Encapsulation type: Ethernet (1)
    Arrival Time: Nov 21, 2023 21:52:23.509221938 -03
    [Time shift for this packet: 0.000000000 seconds]
    Epoch Time: 1700614343.509221938 seconds
    [Time delta from previous captured frame: 0.000350243 seconds]
    [Time delta from previous displayed frame: 0.000350243 seconds]
    [Time since reference or first frame: 0.011052989 seconds]
    Frame Number: 10
    Frame Length: 2034 bytes (16272 bits)
    Capture Length: 2034 bytes (16272 bits)
    [Frame is marked: False]
    [Frame is ignored: False]
    [Protocols in frame: eth:ethertype:ip:tcp:ssh]
Ethernet II, Src: 02:42:ac:11:00:02 (02:42:ac:11:00:02), Dst: 02:42:ac:11:00:05 (02:42:ac:11:00:05)
    Destination: 02:42:ac:11:00:05 (02:42:ac:11:00:05)
        Address: 02:42:ac:11:00:05 (02:42:ac:11:00:05)
        .... ..1. .... .... .... .... = LG bit: Locally administered address (this is NOT the factory default)
        .... ...0 .... .... .... .... = IG bit: Individual address (unicast)
    Source: 02:42:ac:11:00:02 (02:42:ac:11:00:02)
        Address: 02:42:ac:11:00:02 (02:42:ac:11:00:02)
        .... ..1. .... .... .... .... = LG bit: Locally administered address (this is NOT the factory default)
        .... ...0 .... .... .... .... = IG bit: Individual address (unicast)
    Type: IPv4 (0x0800)
Internet Protocol Version 4, Src: 172.17.0.2, Dst: 172.17.0.5
    0100 .... = Version: 4
    .... 0101 = Header Length: 20 bytes (5)
    Differentiated Services Field: 0x00 (DSCP: CS0, ECN: Not-ECT)
        0000 00.. = Differentiated Services Codepoint: Default (0)
        .... ..00 = Explicit Congestion Notification: Not ECN-Capable Transport (0)
    Total Length: 2020
    Identification: 0x2114 (8468)
    010. .... = Flags: 0x2, Don't fragment
        0... .... = Reserved bit: Not set
        .1.. .... = Don't fragment: Set
        ..0. .... = More fragments: Not set
    ...0 0000 0000 0000 = Fragment Offset: 0
    Time to Live: 64
    Protocol: TCP (6)
    Header Checksum: 0xb9d6 [validation disabled]
    [Header checksum status: Unverified]
    Source Address: 172.17.0.2
    Destination Address: 172.17.0.5
Transmission Control Protocol, Src Port: 52388, Dst Port: 22, Seq: 35, Ack: 42, Len: 1968
    Source Port: 52388
    Destination Port: 22
    [Stream index: 0]
    [Conversation completeness: Incomplete, DATA (15)]
    [TCP Segment Len: 1968]
    Sequence Number: 35    (relative sequence number)
    Sequence Number (raw): 200777124
    [Next Sequence Number: 2003    (relative sequence number)]
    Acknowledgment Number: 42    (relative ack number)
    Acknowledgment number (raw): 3572532597
    1000 .... = Header Length: 32 bytes (8)
    Flags: 0x018 (PSH, ACK)
        000. .... .... = Reserved: Not set
        ...0 .... .... = Accurate ECN: Not set
        .... 0... .... = Congestion Window Reduced: Not set
        .... .0.. .... = ECN-Echo: Not set
        .... ..0. .... = Urgent: Not set
        .... ...1 .... = Acknowledgment: Set
        .... .... 1... = Push: Set
        .... .... .0.. = Reset: Not set
        .... .... ..0. = Syn: Not set
        .... .... ...0 = Fin: Not set
        [TCP Flags: ·······AP···]
    Window: 502
    [Calculated window size: 64256]
    [Window size scaling factor: 128]
    Checksum: 0x6000 [unverified]
    [Checksum Status: Unverified]
    Urgent Pointer: 0
    Options: (12 bytes), No-Operation (NOP), No-Operation (NOP), Timestamps
        TCP Option - No-Operation (NOP)
            Kind: No-Operation (1)
        TCP Option - No-Operation (NOP)
            Kind: No-Operation (1)
        TCP Option - Timestamps
            Kind: Time Stamp Option (8)
            Length: 10
            Timestamp value: 1233745089: TSval 1233745089, TSecr 3458410076
            Timestamp echo reply: 3458410076
    [Timestamps]
        [Time since first frame in this TCP stream: 0.010976878 seconds]
        [Time since previous frame in this TCP stream: 0.000350243 seconds]
    [SEQ/ACK analysis]
        [iRTT: 0.000031898 seconds]
        [Bytes in flight: 1968]
        [Bytes sent since last PSH flag: 1968]
    TCP payload (1968 bytes)
SSH Protocol
    SSH Version 2
        Packet Length: 1964
        Padding Length: 8
        Key Exchange
            Message Code: Key Exchange Init (20)
            Algorithms
                Cookie: 6f8ff9f1abcfaf7d342bc88b1e873190
                kex_algorithms length: 212
                kex_algorithms string: curve25519-sha256@libssh.org,ecdh-sha2-nistp256,ecdh-sha2-nistp384,ecdh-sha2-nistp521,diffie-hellman-group-exchange-sha256,diffie-hellman-group-exchange-sha1,diffie-hellman-group14-sha1,diffie-hellman-group1-sha1
                server_host_key_algorithms length: 359
                server_host_key_algorithms string [truncated]: ecdsa-sha2-nistp256-cert-v01@openssh.com,ecdsa-sha2-nistp384-cert-v01@openssh.com,ecdsa-sha2-nistp521-cert-v01@openssh.com,ssh-ed25519-cert-v01@openssh.com,ssh-rsa-cert-v01@openssh.com,ssh-ds
                encryption_algorithms_client_to_server length: 233
