Frame 1: 42 bytes on wire (336 bits), 42 bytes captured (336 bits) on interface docker0, id 0
    Section number: 1
    Interface id: 0 (docker0)
        Interface name: docker0
    Encapsulation type: Ethernet (1)
    Arrival Time: Nov 21, 2023 21:58:21.762992290 -03
    [Time shift for this packet: 0.000000000 seconds]
    Epoch Time: 1700614701.762992290 seconds
    [Time delta from previous captured frame: 0.000000000 seconds]
    [Time delta from previous displayed frame: 0.000000000 seconds]
    [Time since reference or first frame: 0.000000000 seconds]
    Frame Number: 1
    Frame Length: 42 bytes (336 bits)
    Capture Length: 42 bytes (336 bits)
    [Frame is marked: False]
    [Frame is ignored: False]
    [Protocols in frame: eth:ethertype:arp]
Ethernet II, Src: 02:42:ac:11:00:03 (02:42:ac:11:00:03), Dst: Broadcast (ff:ff:ff:ff:ff:ff)
    Destination: Broadcast (ff:ff:ff:ff:ff:ff)
        Address: Broadcast (ff:ff:ff:ff:ff:ff)
        .... ..1. .... .... .... .... = LG bit: Locally administered address (this is NOT the factory default)
        .... ...1 .... .... .... .... = IG bit: Group address (multicast/broadcast)
    Source: 02:42:ac:11:00:03 (02:42:ac:11:00:03)
        Address: 02:42:ac:11:00:03 (02:42:ac:11:00:03)
        .... ..1. .... .... .... .... = LG bit: Locally administered address (this is NOT the factory default)
        .... ...0 .... .... .... .... = IG bit: Individual address (unicast)
    Type: ARP (0x0806)
Address Resolution Protocol (request)
    Hardware type: Ethernet (1)
    Protocol type: IPv4 (0x0800)
    Hardware size: 6
    Protocol size: 4
    Opcode: request (1)
    Sender MAC address: 02:42:ac:11:00:03 (02:42:ac:11:00:03)
    Sender IP address: 172.17.0.3
    Target MAC address: 00:00:00_00:00:00 (00:00:00:00:00:00)
    Target IP address: 172.17.0.5

Frame 2: 42 bytes on wire (336 bits), 42 bytes captured (336 bits) on interface docker0, id 0
    Section number: 1
    Interface id: 0 (docker0)
        Interface name: docker0
    Encapsulation type: Ethernet (1)
    Arrival Time: Nov 21, 2023 21:58:21.763039789 -03
    [Time shift for this packet: 0.000000000 seconds]
    Epoch Time: 1700614701.763039789 seconds
    [Time delta from previous captured frame: 0.000047499 seconds]
    [Time delta from previous displayed frame: 0.000047499 seconds]
    [Time since reference or first frame: 0.000047499 seconds]
    Frame Number: 2
    Frame Length: 42 bytes (336 bits)
    Capture Length: 42 bytes (336 bits)
    [Frame is marked: False]
    [Frame is ignored: False]
    [Protocols in frame: eth:ethertype:arp]
Ethernet II, Src: 02:42:ac:11:00:05 (02:42:ac:11:00:05), Dst: 02:42:ac:11:00:03 (02:42:ac:11:00:03)
    Destination: 02:42:ac:11:00:03 (02:42:ac:11:00:03)
        Address: 02:42:ac:11:00:03 (02:42:ac:11:00:03)
        .... ..1. .... .... .... .... = LG bit: Locally administered address (this is NOT the factory default)
        .... ...0 .... .... .... .... = IG bit: Individual address (unicast)
    Source: 02:42:ac:11:00:05 (02:42:ac:11:00:05)
        Address: 02:42:ac:11:00:05 (02:42:ac:11:00:05)
        .... ..1. .... .... .... .... = LG bit: Locally administered address (this is NOT the factory default)
        .... ...0 .... .... .... .... = IG bit: Individual address (unicast)
    Type: ARP (0x0806)
Address Resolution Protocol (reply)
    Hardware type: Ethernet (1)
    Protocol type: IPv4 (0x0800)
    Hardware size: 6
    Protocol size: 4
    Opcode: reply (2)
    Sender MAC address: 02:42:ac:11:00:05 (02:42:ac:11:00:05)
    Sender IP address: 172.17.0.5
    Target MAC address: 02:42:ac:11:00:03 (02:42:ac:11:00:03)
    Target IP address: 172.17.0.3

Frame 3: 74 bytes on wire (592 bits), 74 bytes captured (592 bits) on interface docker0, id 0
    Section number: 1
    Interface id: 0 (docker0)
        Interface name: docker0
    Encapsulation type: Ethernet (1)
    Arrival Time: Nov 21, 2023 21:58:21.763066065 -03
    [Time shift for this packet: 0.000000000 seconds]
    Epoch Time: 1700614701.763066065 seconds
    [Time delta from previous captured frame: 0.000026276 seconds]
    [Time delta from previous displayed frame: 0.000026276 seconds]
    [Time since reference or first frame: 0.000073775 seconds]
    Frame Number: 3
    Frame Length: 74 bytes (592 bits)
    Capture Length: 74 bytes (592 bits)
    [Frame is marked: False]
    [Frame is ignored: False]
    [Protocols in frame: eth:ethertype:ip:tcp]
Ethernet II, Src: 02:42:ac:11:00:03 (02:42:ac:11:00:03), Dst: 02:42:ac:11:00:05 (02:42:ac:11:00:05)
    Destination: 02:42:ac:11:00:05 (02:42:ac:11:00:05)
        Address: 02:42:ac:11:00:05 (02:42:ac:11:00:05)
        .... ..1. .... .... .... .... = LG bit: Locally administered address (this is NOT the factory default)
        .... ...0 .... .... .... .... = IG bit: Individual address (unicast)
    Source: 02:42:ac:11:00:03 (02:42:ac:11:00:03)
        Address: 02:42:ac:11:00:03 (02:42:ac:11:00:03)
        .... ..1. .... .... .... .... = LG bit: Locally administered address (this is NOT the factory default)
        .... ...0 .... .... .... .... = IG bit: Individual address (unicast)
    Type: IPv4 (0x0800)
Internet Protocol Version 4, Src: 172.17.0.3, Dst: 172.17.0.5
    0100 .... = Version: 4
    .... 0101 = Header Length: 20 bytes (5)
    Differentiated Services Field: 0x00 (DSCP: CS0, ECN: Not-ECT)
        0000 00.. = Differentiated Services Codepoint: Default (0)
        .... ..00 = Explicit Congestion Notification: Not ECN-Capable Transport (0)
    Total Length: 60
    Identification: 0x1f9d (8093)
    010. .... = Flags: 0x2, Don't fragment
        0... .... = Reserved bit: Not set
        .1.. .... = Don't fragment: Set
        ..0. .... = More fragments: Not set
    ...0 0000 0000 0000 = Fragment Offset: 0
    Time to Live: 64
    Protocol: TCP (6)
    Header Checksum: 0xc2f4 [validation disabled]
    [Header checksum status: Unverified]
    Source Address: 172.17.0.3
    Destination Address: 172.17.0.5
Transmission Control Protocol, Src Port: 46896, Dst Port: 22, Seq: 0, Len: 0
    Source Port: 46896
    Destination Port: 22
    [Stream index: 0]
    [Conversation completeness: Incomplete (0)]
    [TCP Segment Len: 0]
    Sequence Number: 0    (relative sequence number)
    Sequence Number (raw): 3950239174
    [Next Sequence Number: 1    (relative sequence number)]
    Acknowledgment Number: 0
    Acknowledgment number (raw): 0
    1010 .... = Header Length: 40 bytes (10)
    Flags: 0x002 (SYN)
        000. .... .... = Reserved: Not set
        ...0 .... .... = Accurate ECN: Not set
        .... 0... .... = Congestion Window Reduced: Not set
        .... .0.. .... = ECN-Echo: Not set
        .... ..0. .... = Urgent: Not set
        .... ...0 .... = Acknowledgment: Not set
        .... .... 0... = Push: Not set
        .... .... .0.. = Reset: Not set
        .... .... ..1. = Syn: Set
            [Expert Info (Chat/Sequence): Connection establish request (SYN): server port 22]
                [Connection establish request (SYN): server port 22]
                [Severity level: Chat]
                [Group: Sequence]
        .... .... ...0 = Fin: Not set
        [TCP Flags: ··········S·]
    Window: 64240
    [Calculated window size: 64240]
    Checksum: 0x5859 [unverified]
    [Checksum Status: Unverified]
    Urgent Pointer: 0
    Options: (20 bytes), Maximum segment size, SACK permitted, Timestamps, No-Operation (NOP), Window scale
        TCP Option - Maximum segment size: 1460 bytes
            Kind: Maximum Segment Size (2)
            Length: 4
            MSS Value: 1460
        TCP Option - SACK permitted
            Kind: SACK Permitted (4)
            Length: 2
        TCP Option - Timestamps
            Kind: Time Stamp Option (8)
            Length: 10
            Timestamp value: 1868571809: TSval 1868571809, TSecr 0
            Timestamp echo reply: 0
        TCP Option - No-Operation (NOP)
            Kind: No-Operation (1)
        TCP Option - Window scale: 7 (multiply by 128)
            Kind: Window Scale (3)
            Length: 3
            Shift count: 7
            [Multiplier: 128]
    [Timestamps]
        [Time since first frame in this TCP stream: 0.000000000 seconds]
        [Time since previous frame in this TCP stream: 0.000000000 seconds]

Frame 4: 74 bytes on wire (592 bits), 74 bytes captured (592 bits) on interface docker0, id 0
    Section number: 1
    Interface id: 0 (docker0)
        Interface name: docker0
    Encapsulation type: Ethernet (1)
    Arrival Time: Nov 21, 2023 21:58:21.763081517 -03
    [Time shift for this packet: 0.000000000 seconds]
    Epoch Time: 1700614701.763081517 seconds
    [Time delta from previous captured frame: 0.000015452 seconds]
    [Time delta from previous displayed frame: 0.000015452 seconds]
    [Time since reference or first frame: 0.000089227 seconds]
    Frame Number: 4
    Frame Length: 74 bytes (592 bits)
    Capture Length: 74 bytes (592 bits)
    [Frame is marked: False]
    [Frame is ignored: False]
    [Protocols in frame: eth:ethertype:ip:tcp]
Ethernet II, Src: 02:42:ac:11:00:05 (02:42:ac:11:00:05), Dst: 02:42:ac:11:00:03 (02:42:ac:11:00:03)
    Destination: 02:42:ac:11:00:03 (02:42:ac:11:00:03)
        Address: 02:42:ac:11:00:03 (02:42:ac:11:00:03)
        .... ..1. .... .... .... .... = LG bit: Locally administered address (this is NOT the factory default)
        .... ...0 .... .... .... .... = IG bit: Individual address (unicast)
    Source: 02:42:ac:11:00:05 (02:42:ac:11:00:05)
        Address: 02:42:ac:11:00:05 (02:42:ac:11:00:05)
        .... ..1. .... .... .... .... = LG bit: Locally administered address (this is NOT the factory default)
        .... ...0 .... .... .... .... = IG bit: Individual address (unicast)
    Type: IPv4 (0x0800)
Internet Protocol Version 4, Src: 172.17.0.5, Dst: 172.17.0.3
    0100 .... = Version: 4
    .... 0101 = Header Length: 20 bytes (5)
    Differentiated Services Field: 0x00 (DSCP: CS0, ECN: Not-ECT)
        0000 00.. = Differentiated Services Codepoint: Default (0)
        .... ..00 = Explicit Congestion Notification: Not ECN-Capable Transport (0)
    Total Length: 60
    Identification: 0x0000 (0)
    010. .... = Flags: 0x2, Don't fragment
        0... .... = Reserved bit: Not set
        .1.. .... = Don't fragment: Set
        ..0. .... = More fragments: Not set
    ...0 0000 0000 0000 = Fragment Offset: 0
    Time to Live: 64
    Protocol: TCP (6)
    Header Checksum: 0xe291 [validation disabled]
    [Header checksum status: Unverified]
    Source Address: 172.17.0.5
    Destination Address: 172.17.0.3
Transmission Control Protocol, Src Port: 22, Dst Port: 46896, Seq: 0, Ack: 1, Len: 0
    Source Port: 22
    Destination Port: 46896
    [Stream index: 0]
    [Conversation completeness: Incomplete, SYN_SENT (1)]
    [TCP Segment Len: 0]
    Sequence Number: 0    (relative sequence number)
    Sequence Number (raw): 1453315468
    [Next Sequence Number: 1    (relative sequence number)]
    Acknowledgment Number: 1    (relative ack number)
    Acknowledgment number (raw): 3950239175
    1010 .... = Header Length: 40 bytes (10)
    Flags: 0x012 (SYN, ACK)
        000. .... .... = Reserved: Not set
        ...0 .... .... = Accurate ECN: Not set
        .... 0... .... = Congestion Window Reduced: Not set
        .... .0.. .... = ECN-Echo: Not set
        .... ..0. .... = Urgent: Not set
        .... ...1 .... = Acknowledgment: Set
        .... .... 0... = Push: Not set
        .... .... .0.. = Reset: Not set
        .... .... ..1. = Syn: Set
            [Expert Info (Chat/Sequence): Connection establish acknowledge (SYN+ACK): server port 22]
                [Connection establish acknowledge (SYN+ACK): server port 22]
                [Severity level: Chat]
                [Group: Sequence]
        .... .... ...0 = Fin: Not set
        [TCP Flags: ·······A··S·]
    Window: 65160
    [Calculated window size: 65160]
    Checksum: 0x5859 [unverified]
    [Checksum Status: Unverified]
    Urgent Pointer: 0
    Options: (20 bytes), Maximum segment size, SACK permitted, Timestamps, No-Operation (NOP), Window scale
        TCP Option - Maximum segment size: 1460 bytes
            Kind: Maximum Segment Size (2)
            Length: 4
            MSS Value: 1460
        TCP Option - SACK permitted
            Kind: SACK Permitted (4)
            Length: 2
        TCP Option - Timestamps
            Kind: Time Stamp Option (8)
            Length: 10
            Timestamp value: 2740824435: TSval 2740824435, TSecr 1868571809
            Timestamp echo reply: 1868571809
        TCP Option - No-Operation (NOP)
            Kind: No-Operation (1)
        TCP Option - Window scale: 7 (multiply by 128)
            Kind: Window Scale (3)
            Length: 3
            Shift count: 7
            [Multiplier: 128]
    [Timestamps]
        [Time since first frame in this TCP stream: 0.000015452 seconds]
        [Time since previous frame in this TCP stream: 0.000015452 seconds]
    [SEQ/ACK analysis]
        [This is an ACK to the segment in frame: 3]
        [The RTT to ACK the segment was: 0.000015452 seconds]

Frame 5: 66 bytes on wire (528 bits), 66 bytes captured (528 bits) on interface docker0, id 0
    Section number: 1
    Interface id: 0 (docker0)
        Interface name: docker0
    Encapsulation type: Ethernet (1)
    Arrival Time: Nov 21, 2023 21:58:21.763093762 -03
    [Time shift for this packet: 0.000000000 seconds]
    Epoch Time: 1700614701.763093762 seconds
    [Time delta from previous captured frame: 0.000012245 seconds]
    [Time delta from previous displayed frame: 0.000012245 seconds]
    [Time since reference or first frame: 0.000101472 seconds]
    Frame Number: 5
    Frame Length: 66 bytes (528 bits)
    Capture Length: 66 bytes (528 bits)
    [Frame is marked: False]
    [Frame is ignored: False]
    [Protocols in frame: eth:ethertype:ip:tcp]
Ethernet II, Src: 02:42:ac:11:00:03 (02:42:ac:11:00:03), Dst: 02:42:ac:11:00:05 (02:42:ac:11:00:05)
    Destination: 02:42:ac:11:00:05 (02:42:ac:11:00:05)
        Address: 02:42:ac:11:00:05 (02:42:ac:11:00:05)
        .... ..1. .... .... .... .... = LG bit: Locally administered address (this is NOT the factory default)
        .... ...0 .... .... .... .... = IG bit: Individual address (unicast)
    Source: 02:42:ac:11:00:03 (02:42:ac:11:00:03)
        Address: 02:42:ac:11:00:03 (02:42:ac:11:00:03)
        .... ..1. .... .... .... .... = LG bit: Locally administered address (this is NOT the factory default)
        .... ...0 .... .... .... .... = IG bit: Individual address (unicast)
    Type: IPv4 (0x0800)
Internet Protocol Version 4, Src: 172.17.0.3, Dst: 172.17.0.5
    0100 .... = Version: 4
    .... 0101 = Header Length: 20 bytes (5)
    Differentiated Services Field: 0x00 (DSCP: CS0, ECN: Not-ECT)
        0000 00.. = Differentiated Services Codepoint: Default (0)
        .... ..00 = Explicit Congestion Notification: Not ECN-Capable Transport (0)
    Total Length: 52
    Identification: 0x1f9e (8094)
    010. .... = Flags: 0x2, Don't fragment
        0... .... = Reserved bit: Not set
        .1.. .... = Don't fragment: Set
        ..0. .... = More fragments: Not set
    ...0 0000 0000 0000 = Fragment Offset: 0
    Time to Live: 64
    Protocol: TCP (6)
    Header Checksum: 0xc2fb [validation disabled]
    [Header checksum status: Unverified]
    Source Address: 172.17.0.3
    Destination Address: 172.17.0.5
Transmission Control Protocol, Src Port: 46896, Dst Port: 22, Seq: 1, Ack: 1, Len: 0
    Source Port: 46896
    Destination Port: 22
    [Stream index: 0]
    [Conversation completeness: Incomplete, CLIENT_ESTABLISHED (3)]
    [TCP Segment Len: 0]
    Sequence Number: 1    (relative sequence number)
    Sequence Number (raw): 3950239175
    [Next Sequence Number: 1    (relative sequence number)]
    Acknowledgment Number: 1    (relative ack number)
    Acknowledgment number (raw): 1453315469
    1000 .... = Header Length: 32 bytes (8)
    Flags: 0x010 (ACK)
        000. .... .... = Reserved: Not set
        ...0 .... .... = Accurate ECN: Not set
        .... 0... .... = Congestion Window Reduced: Not set
        .... .0.. .... = ECN-Echo: Not set
        .... ..0. .... = Urgent: Not set
        .... ...1 .... = Acknowledgment: Set
        .... .... 0... = Push: Not set
        .... .... .0.. = Reset: Not set
        .... .... ..0. = Syn: Not set
        .... .... ...0 = Fin: Not set
        [TCP Flags: ·······A····]
    Window: 502
    [Calculated window size: 64256]
    [Window size scaling factor: 128]
    Checksum: 0x5851 [unverified]
    [Checksum Status: Unverified]
    Urgent Pointer: 0
    Options: (12 bytes), No-Operation (NOP), No-Operation (NOP), Timestamps
        TCP Option - No-Operation (NOP)
            Kind: No-Operation (1)
        TCP Option - No-Operation (NOP)
            Kind: No-Operation (1)
        TCP Option - Timestamps
            Kind: Time Stamp Option (8)
            Length: 10
            Timestamp value: 1868571809: TSval 1868571809, TSecr 2740824435
            Timestamp echo reply: 2740824435
    [Timestamps]
        [Time since first frame in this TCP stream: 0.000027697 seconds]
        [Time since previous frame in this TCP stream: 0.000012245 seconds]
    [SEQ/ACK analysis]
        [This is an ACK to the segment in frame: 4]
        [The RTT to ACK the segment was: 0.000012245 seconds]
        [iRTT: 0.000027697 seconds]

Frame 6: 107 bytes on wire (856 bits), 107 bytes captured (856 bits) on interface docker0, id 0
    Section number: 1
    Interface id: 0 (docker0)
        Interface name: docker0
    Encapsulation type: Ethernet (1)
    Arrival Time: Nov 21, 2023 21:58:21.763465167 -03
    [Time shift for this packet: 0.000000000 seconds]
    Epoch Time: 1700614701.763465167 seconds
    [Time delta from previous captured frame: 0.000371405 seconds]
    [Time delta from previous displayed frame: 0.000371405 seconds]
    [Time since reference or first frame: 0.000472877 seconds]
    Frame Number: 6
    Frame Length: 107 bytes (856 bits)
    Capture Length: 107 bytes (856 bits)
    [Frame is marked: False]
    [Frame is ignored: False]
    [Protocols in frame: eth:ethertype:ip:tcp:ssh]
Ethernet II, Src: 02:42:ac:11:00:03 (02:42:ac:11:00:03), Dst: 02:42:ac:11:00:05 (02:42:ac:11:00:05)
    Destination: 02:42:ac:11:00:05 (02:42:ac:11:00:05)
        Address: 02:42:ac:11:00:05 (02:42:ac:11:00:05)
        .... ..1. .... .... .... .... = LG bit: Locally administered address (this is NOT the factory default)
        .... ...0 .... .... .... .... = IG bit: Individual address (unicast)
    Source: 02:42:ac:11:00:03 (02:42:ac:11:00:03)
        Address: 02:42:ac:11:00:03 (02:42:ac:11:00:03)
        .... ..1. .... .... .... .... = LG bit: Locally administered address (this is NOT the factory default)
        .... ...0 .... .... .... .... = IG bit: Individual address (unicast)
    Type: IPv4 (0x0800)
Internet Protocol Version 4, Src: 172.17.0.3, Dst: 172.17.0.5
    0100 .... = Version: 4
    .... 0101 = Header Length: 20 bytes (5)
    Differentiated Services Field: 0x00 (DSCP: CS0, ECN: Not-ECT)
        0000 00.. = Differentiated Services Codepoint: Default (0)
        .... ..00 = Explicit Congestion Notification: Not ECN-Capable Transport (0)
    Total Length: 93
    Identification: 0x1f9f (8095)
    010. .... = Flags: 0x2, Don't fragment
        0... .... = Reserved bit: Not set
        .1.. .... = Don't fragment: Set
        ..0. .... = More fragments: Not set
    ...0 0000 0000 0000 = Fragment Offset: 0
    Time to Live: 64
    Protocol: TCP (6)
    Header Checksum: 0xc2d1 [validation disabled]
    [Header checksum status: Unverified]
    Source Address: 172.17.0.3
    Destination Address: 172.17.0.5
Transmission Control Protocol, Src Port: 46896, Dst Port: 22, Seq: 1, Ack: 1, Len: 41
    Source Port: 46896
    Destination Port: 22
    [Stream index: 0]
    [Conversation completeness: Incomplete, ESTABLISHED (7)]
    [TCP Segment Len: 41]
    Sequence Number: 1    (relative sequence number)
    Sequence Number (raw): 3950239175
    [Next Sequence Number: 42    (relative sequence number)]
    Acknowledgment Number: 1    (relative ack number)
    Acknowledgment number (raw): 1453315469
    1000 .... = Header Length: 32 bytes (8)
    Flags: 0x018 (PSH, ACK)
        000. .... .... = Reserved: Not set
        ...0 .... .... = Accurate ECN: Not set
        .... 0... .... = Congestion Window Reduced: Not set
        .... .0.. .... = ECN-Echo: Not set
        .... ..0. .... = Urgent: Not set
        .... ...1 .... = Acknowledgment: Set
        .... .... 1... = Push: Set
        .... .... .0.. = Reset: Not set
        .... .... ..0. = Syn: Not set
        .... .... ...0 = Fin: Not set
        [TCP Flags: ·······AP···]
    Window: 502
    [Calculated window size: 64256]
    [Window size scaling factor: 128]
    Checksum: 0x587a [unverified]
    [Checksum Status: Unverified]
    Urgent Pointer: 0
    Options: (12 bytes), No-Operation (NOP), No-Operation (NOP), Timestamps
        TCP Option - No-Operation (NOP)
            Kind: No-Operation (1)
        TCP Option - No-Operation (NOP)
            Kind: No-Operation (1)
        TCP Option - Timestamps
            Kind: Time Stamp Option (8)
            Length: 10
            Timestamp value: 1868571809: TSval 1868571809, TSecr 2740824435
            Timestamp echo reply: 2740824435
    [Timestamps]
        [Time since first frame in this TCP stream: 0.000399102 seconds]
        [Time since previous frame in this TCP stream: 0.000371405 seconds]
    [SEQ/ACK analysis]
        [iRTT: 0.000027697 seconds]
        [Bytes in flight: 41]
        [Bytes sent since last PSH flag: 41]
    TCP payload (41 bytes)
SSH Protocol
    Protocol: SSH-2.0-OpenSSH_7.3p1 Ubuntu-1ubuntu0.1
    [Direction: client-to-server]

Frame 7: 66 bytes on wire (528 bits), 66 bytes captured (528 bits) on interface docker0, id 0
    Section number: 1
    Interface id: 0 (docker0)
        Interface name: docker0
    Encapsulation type: Ethernet (1)
    Arrival Time: Nov 21, 2023 21:58:21.763473989 -03
    [Time shift for this packet: 0.000000000 seconds]
    Epoch Time: 1700614701.763473989 seconds
    [Time delta from previous captured frame: 0.000008822 seconds]
    [Time delta from previous displayed frame: 0.000008822 seconds]
    [Time since reference or first frame: 0.000481699 seconds]
    Frame Number: 7
    Frame Length: 66 bytes (528 bits)
    Capture Length: 66 bytes (528 bits)
    [Frame is marked: False]
    [Frame is ignored: False]
    [Protocols in frame: eth:ethertype:ip:tcp]
Ethernet II, Src: 02:42:ac:11:00:05 (02:42:ac:11:00:05), Dst: 02:42:ac:11:00:03 (02:42:ac:11:00:03)
    Destination: 02:42:ac:11:00:03 (02:42:ac:11:00:03)
        Address: 02:42:ac:11:00:03 (02:42:ac:11:00:03)
        .... ..1. .... .... .... .... = LG bit: Locally administered address (this is NOT the factory default)
        .... ...0 .... .... .... .... = IG bit: Individual address (unicast)
    Source: 02:42:ac:11:00:05 (02:42:ac:11:00:05)
        Address: 02:42:ac:11:00:05 (02:42:ac:11:00:05)
        .... ..1. .... .... .... .... = LG bit: Locally administered address (this is NOT the factory default)
        .... ...0 .... .... .... .... = IG bit: Individual address (unicast)
    Type: IPv4 (0x0800)
Internet Protocol Version 4, Src: 172.17.0.5, Dst: 172.17.0.3
    0100 .... = Version: 4
    .... 0101 = Header Length: 20 bytes (5)
    Differentiated Services Field: 0x00 (DSCP: CS0, ECN: Not-ECT)
        0000 00.. = Differentiated Services Codepoint: Default (0)
        .... ..00 = Explicit Congestion Notification: Not ECN-Capable Transport (0)
    Total Length: 52
    Identification: 0xf068 (61544)
    010. .... = Flags: 0x2, Don't fragment
        0... .... = Reserved bit: Not set
        .1.. .... = Don't fragment: Set
        ..0. .... = More fragments: Not set
    ...0 0000 0000 0000 = Fragment Offset: 0
    Time to Live: 64
    Protocol: TCP (6)
    Header Checksum: 0xf230 [validation disabled]
    [Header checksum status: Unverified]
    Source Address: 172.17.0.5
    Destination Address: 172.17.0.3
Transmission Control Protocol, Src Port: 22, Dst Port: 46896, Seq: 1, Ack: 42, Len: 0
    Source Port: 22
    Destination Port: 46896
    [Stream index: 0]
    [Conversation completeness: Incomplete, DATA (15)]
    [TCP Segment Len: 0]
    Sequence Number: 1    (relative sequence number)
    Sequence Number (raw): 1453315469
    [Next Sequence Number: 1    (relative sequence number)]
    Acknowledgment Number: 42    (relative ack number)
    Acknowledgment number (raw): 3950239216
    1000 .... = Header Length: 32 bytes (8)
    Flags: 0x010 (ACK)
        000. .... .... = Reserved: Not set
        ...0 .... .... = Accurate ECN: Not set
        .... 0... .... = Congestion Window Reduced: Not set
        .... .0.. .... = ECN-Echo: Not set
        .... ..0. .... = Urgent: Not set
        .... ...1 .... = Acknowledgment: Set
        .... .... 0... = Push: Not set
        .... .... .0.. = Reset: Not set
        .... .... ..0. = Syn: Not set
        .... .... ...0 = Fin: Not set
        [TCP Flags: ·······A····]
    Window: 509
    [Calculated window size: 65152]
    [Window size scaling factor: 128]
    Checksum: 0x5851 [unverified]
    [Checksum Status: Unverified]
    Urgent Pointer: 0
    Options: (12 bytes), No-Operation (NOP), No-Operation (NOP), Timestamps
        TCP Option - No-Operation (NOP)
            Kind: No-Operation (1)
        TCP Option - No-Operation (NOP)
            Kind: No-Operation (1)
        TCP Option - Timestamps
            Kind: Time Stamp Option (8)
            Length: 10
            Timestamp value: 2740824435: TSval 2740824435, TSecr 1868571809
            Timestamp echo reply: 1868571809
    [Timestamps]
        [Time since first frame in this TCP stream: 0.000407924 seconds]
        [Time since previous frame in this TCP stream: 0.000008822 seconds]
    [SEQ/ACK analysis]
        [This is an ACK to the segment in frame: 6]
        [The RTT to ACK the segment was: 0.000008822 seconds]
        [iRTT: 0.000027697 seconds]

Frame 8: 107 bytes on wire (856 bits), 107 bytes captured (856 bits) on interface docker0, id 0
    Section number: 1
    Interface id: 0 (docker0)
        Interface name: docker0
    Encapsulation type: Ethernet (1)
    Arrival Time: Nov 21, 2023 21:58:21.771472711 -03
    [Time shift for this packet: 0.000000000 seconds]
    Epoch Time: 1700614701.771472711 seconds
    [Time delta from previous captured frame: 0.007998722 seconds]
    [Time delta from previous displayed frame: 0.007998722 seconds]
    [Time since reference or first frame: 0.008480421 seconds]
    Frame Number: 8
    Frame Length: 107 bytes (856 bits)
    Capture Length: 107 bytes (856 bits)
    [Frame is marked: False]
    [Frame is ignored: False]
    [Protocols in frame: eth:ethertype:ip:tcp:ssh]
Ethernet II, Src: 02:42:ac:11:00:05 (02:42:ac:11:00:05), Dst: 02:42:ac:11:00:03 (02:42:ac:11:00:03)
    Destination: 02:42:ac:11:00:03 (02:42:ac:11:00:03)
        Address: 02:42:ac:11:00:03 (02:42:ac:11:00:03)
        .... ..1. .... .... .... .... = LG bit: Locally administered address (this is NOT the factory default)
        .... ...0 .... .... .... .... = IG bit: Individual address (unicast)
    Source: 02:42:ac:11:00:05 (02:42:ac:11:00:05)
        Address: 02:42:ac:11:00:05 (02:42:ac:11:00:05)
        .... ..1. .... .... .... .... = LG bit: Locally administered address (this is NOT the factory default)
        .... ...0 .... .... .... .... = IG bit: Individual address (unicast)
    Type: IPv4 (0x0800)
Internet Protocol Version 4, Src: 172.17.0.5, Dst: 172.17.0.3
    0100 .... = Version: 4
    .... 0101 = Header Length: 20 bytes (5)
    Differentiated Services Field: 0x00 (DSCP: CS0, ECN: Not-ECT)
        0000 00.. = Differentiated Services Codepoint: Default (0)
        .... ..00 = Explicit Congestion Notification: Not ECN-Capable Transport (0)
    Total Length: 93
    Identification: 0xf069 (61545)
    010. .... = Flags: 0x2, Don't fragment
        0... .... = Reserved bit: Not set
        .1.. .... = Don't fragment: Set
        ..0. .... = More fragments: Not set
    ...0 0000 0000 0000 = Fragment Offset: 0
    Time to Live: 64
    Protocol: TCP (6)
    Header Checksum: 0xf206 [validation disabled]
    [Header checksum status: Unverified]
    Source Address: 172.17.0.5
    Destination Address: 172.17.0.3
Transmission Control Protocol, Src Port: 22, Dst Port: 46896, Seq: 1, Ack: 42, Len: 41
    Source Port: 22
    Destination Port: 46896
    [Stream index: 0]
    [Conversation completeness: Incomplete, DATA (15)]
    [TCP Segment Len: 41]
    Sequence Number: 1    (relative sequence number)
    Sequence Number (raw): 1453315469
    [Next Sequence Number: 42    (relative sequence number)]
    Acknowledgment Number: 42    (relative ack number)
    Acknowledgment number (raw): 3950239216
    1000 .... = Header Length: 32 bytes (8)
    Flags: 0x018 (PSH, ACK)
        000. .... .... = Reserved: Not set
        ...0 .... .... = Accurate ECN: Not set
        .... 0... .... = Congestion Window Reduced: Not set
        .... .0.. .... = ECN-Echo: Not set
        .... ..0. .... = Urgent: Not set
        .... ...1 .... = Acknowledgment: Set
        .... .... 1... = Push: Set
        .... .... .0.. = Reset: Not set
        .... .... ..0. = Syn: Not set
        .... .... ...0 = Fin: Not set
        [TCP Flags: ·······AP···]
    Window: 509
    [Calculated window size: 65152]
    [Window size scaling factor: 128]
    Checksum: 0x587a [unverified]
    [Checksum Status: Unverified]
    Urgent Pointer: 0
    Options: (12 bytes), No-Operation (NOP), No-Operation (NOP), Timestamps
        TCP Option - No-Operation (NOP)
            Kind: No-Operation (1)
        TCP Option - No-Operation (NOP)
            Kind: No-Operation (1)
        TCP Option - Timestamps
            Kind: Time Stamp Option (8)
            Length: 10
            Timestamp value: 2740824443: TSval 2740824443, TSecr 1868571809
            Timestamp echo reply: 1868571809
    [Timestamps]
        [Time since first frame in this TCP stream: 0.008406646 seconds]
        [Time since previous frame in this TCP stream: 0.007998722 seconds]
    [SEQ/ACK analysis]
        [iRTT: 0.000027697 seconds]
        [Bytes in flight: 41]
        [Bytes sent since last PSH flag: 41]
    TCP payload (41 bytes)
SSH Protocol
    Protocol: SSH-2.0-OpenSSH_8.3p1 Ubuntu-1ubuntu0.1
    [Direction: server-to-client]

Frame 9: 66 bytes on wire (528 bits), 66 bytes captured (528 bits) on interface docker0, id 0
    Section number: 1
    Interface id: 0 (docker0)
        Interface name: docker0
    Encapsulation type: Ethernet (1)
    Arrival Time: Nov 21, 2023 21:58:21.771514120 -03
    [Time shift for this packet: 0.000000000 seconds]
    Epoch Time: 1700614701.771514120 seconds
    [Time delta from previous captured frame: 0.000041409 seconds]
    [Time delta from previous displayed frame: 0.000041409 seconds]
    [Time since reference or first frame: 0.008521830 seconds]
    Frame Number: 9
    Frame Length: 66 bytes (528 bits)
    Capture Length: 66 bytes (528 bits)
    [Frame is marked: False]
    [Frame is ignored: False]
    [Protocols in frame: eth:ethertype:ip:tcp]
Ethernet II, Src: 02:42:ac:11:00:03 (02:42:ac:11:00:03), Dst: 02:42:ac:11:00:05 (02:42:ac:11:00:05)
    Destination: 02:42:ac:11:00:05 (02:42:ac:11:00:05)
        Address: 02:42:ac:11:00:05 (02:42:ac:11:00:05)
        .... ..1. .... .... .... .... = LG bit: Locally administered address (this is NOT the factory default)
        .... ...0 .... .... .... .... = IG bit: Individual address (unicast)
    Source: 02:42:ac:11:00:03 (02:42:ac:11:00:03)
        Address: 02:42:ac:11:00:03 (02:42:ac:11:00:03)
        .... ..1. .... .... .... .... = LG bit: Locally administered address (this is NOT the factory default)
        .... ...0 .... .... .... .... = IG bit: Individual address (unicast)
    Type: IPv4 (0x0800)
Internet Protocol Version 4, Src: 172.17.0.3, Dst: 172.17.0.5
    0100 .... = Version: 4
    .... 0101 = Header Length: 20 bytes (5)
    Differentiated Services Field: 0x00 (DSCP: CS0, ECN: Not-ECT)
        0000 00.. = Differentiated Services Codepoint: Default (0)
        .... ..00 = Explicit Congestion Notification: Not ECN-Capable Transport (0)
    Total Length: 52
    Identification: 0x1fa0 (8096)
    010. .... = Flags: 0x2, Don't fragment
        0... .... = Reserved bit: Not set
        .1.. .... = Don't fragment: Set
        ..0. .... = More fragments: Not set
    ...0 0000 0000 0000 = Fragment Offset: 0
    Time to Live: 64
    Protocol: TCP (6)
    Header Checksum: 0xc2f9 [validation disabled]
    [Header checksum status: Unverified]
    Source Address: 172.17.0.3
    Destination Address: 172.17.0.5
Transmission Control Protocol, Src Port: 46896, Dst Port: 22, Seq: 42, Ack: 42, Len: 0
    Source Port: 46896
    Destination Port: 22
    [Stream index: 0]
    [Conversation completeness: Incomplete, DATA (15)]
    [TCP Segment Len: 0]
    Sequence Number: 42    (relative sequence number)
    Sequence Number (raw): 3950239216
    [Next Sequence Number: 42    (relative sequence number)]
    Acknowledgment Number: 42    (relative ack number)
    Acknowledgment number (raw): 1453315510
    1000 .... = Header Length: 32 bytes (8)
    Flags: 0x010 (ACK)
        000. .... .... = Reserved: Not set
        ...0 .... .... = Accurate ECN: Not set
        .... 0... .... = Congestion Window Reduced: Not set
        .... .0.. .... = ECN-Echo: Not set
        .... ..0. .... = Urgent: Not set
        .... ...1 .... = Acknowledgment: Set
        .... .... 0... = Push: Not set
        .... .... .0.. = Reset: Not set
        .... .... ..0. = Syn: Not set
        .... .... ...0 = Fin: Not set
        [TCP Flags: ·······A····]
    Window: 502
    [Calculated window size: 64256]
    [Window size scaling factor: 128]
    Checksum: 0x5851 [unverified]
    [Checksum Status: Unverified]
    Urgent Pointer: 0
    Options: (12 bytes), No-Operation (NOP), No-Operation (NOP), Timestamps
        TCP Option - No-Operation (NOP)
            Kind: No-Operation (1)
        TCP Option - No-Operation (NOP)
            Kind: No-Operation (1)
        TCP Option - Timestamps
            Kind: Time Stamp Option (8)
            Length: 10
            Timestamp value: 1868571817: TSval 1868571817, TSecr 2740824443
            Timestamp echo reply: 2740824443
    [Timestamps]
        [Time since first frame in this TCP stream: 0.008448055 seconds]
        [Time since previous frame in this TCP stream: 0.000041409 seconds]
    [SEQ/ACK analysis]
        [This is an ACK to the segment in frame: 8]
        [The RTT to ACK the segment was: 0.000041409 seconds]
        [iRTT: 0.000027697 seconds]

Frame 10: 1498 bytes on wire (11984 bits), 1498 bytes captured (11984 bits) on interface docker0, id 0
    Section number: 1
    Interface id: 0 (docker0)
        Interface name: docker0
    Encapsulation type: Ethernet (1)
    Arrival Time: Nov 21, 2023 21:58:21.771906240 -03
    [Time shift for this packet: 0.000000000 seconds]
    Epoch Time: 1700614701.771906240 seconds
    [Time delta from previous captured frame: 0.000392120 seconds]
    [Time delta from previous displayed frame: 0.000392120 seconds]
    [Time since reference or first frame: 0.008913950 seconds]
    Frame Number: 10
    Frame Length: 1498 bytes (11984 bits)
    Capture Length: 1498 bytes (11984 bits)
    [Frame is marked: False]
    [Frame is ignored: False]
    [Protocols in frame: eth:ethertype:ip:tcp:ssh]
Ethernet II, Src: 02:42:ac:11:00:03 (02:42:ac:11:00:03), Dst: 02:42:ac:11:00:05 (02:42:ac:11:00:05)
    Destination: 02:42:ac:11:00:05 (02:42:ac:11:00:05)
        Address: 02:42:ac:11:00:05 (02:42:ac:11:00:05)
        .... ..1. .... .... .... .... = LG bit: Locally administered address (this is NOT the factory default)
        .... ...0 .... .... .... .... = IG bit: Individual address (unicast)
    Source: 02:42:ac:11:00:03 (02:42:ac:11:00:03)
        Address: 02:42:ac:11:00:03 (02:42:ac:11:00:03)
        .... ..1. .... .... .... .... = LG bit: Locally administered address (this is NOT the factory default)
        .... ...0 .... .... .... .... = IG bit: Individual address (unicast)
    Type: IPv4 (0x0800)
Internet Protocol Version 4, Src: 172.17.0.3, Dst: 172.17.0.5
    0100 .... = Version: 4
    .... 0101 = Header Length: 20 bytes (5)
    Differentiated Services Field: 0x00 (DSCP: CS0, ECN: Not-ECT)
        0000 00.. = Differentiated Services Codepoint: Default (0)
        .... ..00 = Explicit Congestion Notification: Not ECN-Capable Transport (0)
    Total Length: 1484
    Identification: 0x1fa1 (8097)
    010. .... = Flags: 0x2, Don't fragment
        0... .... = Reserved bit: Not set
        .1.. .... = Don't fragment: Set
        ..0. .... = More fragments: Not set
    ...0 0000 0000 0000 = Fragment Offset: 0
    Time to Live: 64
    Protocol: TCP (6)
    Header Checksum: 0xbd60 [validation disabled]
    [Header checksum status: Unverified]
    Source Address: 172.17.0.3
    Destination Address: 172.17.0.5
Transmission Control Protocol, Src Port: 46896, Dst Port: 22, Seq: 42, Ack: 42, Len: 1432
    Source Port: 46896
    Destination Port: 22
    [Stream index: 0]
    [Conversation completeness: Incomplete, DATA (15)]
    [TCP Segment Len: 1432]
    Sequence Number: 42    (relative sequence number)
    Sequence Number (raw): 3950239216
    [Next Sequence Number: 1474    (relative sequence number)]
    Acknowledgment Number: 42    (relative ack number)
    Acknowledgment number (raw): 1453315510
    1000 .... = Header Length: 32 bytes (8)
    Flags: 0x018 (PSH, ACK)
        000. .... .... = Reserved: Not set
        ...0 .... .... = Accurate ECN: Not set
        .... 0... .... = Congestion Window Reduced: Not set
        .... .0.. .... = ECN-Echo: Not set
        .... ..0. .... = Urgent: Not set
        .... ...1 .... = Acknowledgment: Set
        .... .... 1... = Push: Set
        .... .... .0.. = Reset: Not set
        .... .... ..0. = Syn: Not set
        .... .... ...0 = Fin: Not set
        [TCP Flags: ·······AP···]
    Window: 502
    [Calculated window size: 64256]
    [Window size scaling factor: 128]
    Checksum: 0x5de9 [unverified]
    [Checksum Status: Unverified]
    Urgent Pointer: 0
    Options: (12 bytes), No-Operation (NOP), No-Operation (NOP), Timestamps
        TCP Option - No-Operation (NOP)
            Kind: No-Operation (1)
        TCP Option - No-Operation (NOP)
            Kind: No-Operation (1)
        TCP Option - Timestamps
            Kind: Time Stamp Option (8)
            Length: 10
            Timestamp value: 1868571817: TSval 1868571817, TSecr 2740824443
            Timestamp echo reply: 2740824443
    [Timestamps]
        [Time since first frame in this TCP stream: 0.008840175 seconds]
        [Time since previous frame in this TCP stream: 0.000392120 seconds]
    [SEQ/ACK analysis]
        [iRTT: 0.000027697 seconds]
        [Bytes in flight: 1432]
        [Bytes sent since last PSH flag: 1432]
    TCP payload (1432 bytes)
SSH Protocol
    SSH Version 2
        Packet Length: 1428
        Padding Length: 11
        Key Exchange
            Message Code: Key Exchange Init (20)
            Algorithms
                Cookie: fa19d2c3bba8ca958ae1da2e873d1a99
                kex_algorithms length: 286
                kex_algorithms string [truncated]: curve25519-sha256@libssh.org,ecdh-sha2-nistp256,ecdh-sha2-nistp384,ecdh-sha2-nistp521,diffie-hellman-group-exchange-sha256,diffie-hellman-group16-sha512,diffie-hellman-group18-sha512,diffie-hellman-group
                server_host_key_algorithms length: 290
                server_host_key_algorithms string [truncated]: ecdsa-sha2-nistp256-cert-v01@openssh.com,ecdsa-sha2-nistp384-cert-v01@openssh.com,ecdsa-sha2-nistp521-cert-v01@openssh.com,ssh-ed25519-cert-v01@openssh.com,ssh-rsa-cert-v01@openssh.com,ecdsa-
