Frame 1: 42 bytes on wire (336 bits), 42 bytes captured (336 bits) on interface docker0, id 0
    Section number: 1
    Interface id: 0 (docker0)
        Interface name: docker0
    Encapsulation type: Ethernet (1)
    Arrival Time: Nov 21, 2023 22:06:01.233177809 -03
    [Time shift for this packet: 0.000000000 seconds]
    Epoch Time: 1700615161.233177809 seconds
    [Time delta from previous captured frame: 0.000000000 seconds]
    [Time delta from previous displayed frame: 0.000000000 seconds]
    [Time since reference or first frame: 0.000000000 seconds]
    Frame Number: 1
    Frame Length: 42 bytes (336 bits)
    Capture Length: 42 bytes (336 bits)
    [Frame is marked: False]
    [Frame is ignored: False]
    [Protocols in frame: eth:ethertype:arp]
Ethernet II, Src: 02:42:ac:11:00:04 (02:42:ac:11:00:04), Dst: Broadcast (ff:ff:ff:ff:ff:ff)
    Destination: Broadcast (ff:ff:ff:ff:ff:ff)
        Address: Broadcast (ff:ff:ff:ff:ff:ff)
        .... ..1. .... .... .... .... = LG bit: Locally administered address (this is NOT the factory default)
        .... ...1 .... .... .... .... = IG bit: Group address (multicast/broadcast)
    Source: 02:42:ac:11:00:04 (02:42:ac:11:00:04)
        Address: 02:42:ac:11:00:04 (02:42:ac:11:00:04)
        .... ..1. .... .... .... .... = LG bit: Locally administered address (this is NOT the factory default)
        .... ...0 .... .... .... .... = IG bit: Individual address (unicast)
    Type: ARP (0x0806)
Address Resolution Protocol (request)
    Hardware type: Ethernet (1)
    Protocol type: IPv4 (0x0800)
    Hardware size: 6
    Protocol size: 4
    Opcode: request (1)
    Sender MAC address: 02:42:ac:11:00:04 (02:42:ac:11:00:04)
    Sender IP address: 172.17.0.4
    Target MAC address: 00:00:00_00:00:00 (00:00:00:00:00:00)
    Target IP address: 172.17.0.5

Frame 2: 42 bytes on wire (336 bits), 42 bytes captured (336 bits) on interface docker0, id 0
    Section number: 1
    Interface id: 0 (docker0)
        Interface name: docker0
    Encapsulation type: Ethernet (1)
    Arrival Time: Nov 21, 2023 22:06:01.233222612 -03
    [Time shift for this packet: 0.000000000 seconds]
    Epoch Time: 1700615161.233222612 seconds
    [Time delta from previous captured frame: 0.000044803 seconds]
    [Time delta from previous displayed frame: 0.000044803 seconds]
    [Time since reference or first frame: 0.000044803 seconds]
    Frame Number: 2
    Frame Length: 42 bytes (336 bits)
    Capture Length: 42 bytes (336 bits)
    [Frame is marked: False]
    [Frame is ignored: False]
    [Protocols in frame: eth:ethertype:arp]
Ethernet II, Src: 02:42:ac:11:00:05 (02:42:ac:11:00:05), Dst: 02:42:ac:11:00:04 (02:42:ac:11:00:04)
    Destination: 02:42:ac:11:00:04 (02:42:ac:11:00:04)
        Address: 02:42:ac:11:00:04 (02:42:ac:11:00:04)
        .... ..1. .... .... .... .... = LG bit: Locally administered address (this is NOT the factory default)
        .... ...0 .... .... .... .... = IG bit: Individual address (unicast)
    Source: 02:42:ac:11:00:05 (02:42:ac:11:00:05)
        Address: 02:42:ac:11:00:05 (02:42:ac:11:00:05)
        .... ..1. .... .... .... .... = LG bit: Locally administered address (this is NOT the factory default)
        .... ...0 .... .... .... .... = IG bit: Individual address (unicast)
    Type: ARP (0x0806)
Address Resolution Protocol (reply)
    Hardware type: Ethernet (1)
    Protocol type: IPv4 (0x0800)
    Hardware size: 6
    Protocol size: 4
    Opcode: reply (2)
    Sender MAC address: 02:42:ac:11:00:05 (02:42:ac:11:00:05)
    Sender IP address: 172.17.0.5
    Target MAC address: 02:42:ac:11:00:04 (02:42:ac:11:00:04)
    Target IP address: 172.17.0.4

Frame 3: 74 bytes on wire (592 bits), 74 bytes captured (592 bits) on interface docker0, id 0
    Section number: 1
    Interface id: 0 (docker0)
        Interface name: docker0
    Encapsulation type: Ethernet (1)
    Arrival Time: Nov 21, 2023 22:06:01.233257078 -03
    [Time shift for this packet: 0.000000000 seconds]
    Epoch Time: 1700615161.233257078 seconds
    [Time delta from previous captured frame: 0.000034466 seconds]
    [Time delta from previous displayed frame: 0.000034466 seconds]
    [Time since reference or first frame: 0.000079269 seconds]
    Frame Number: 3
    Frame Length: 74 bytes (592 bits)
    Capture Length: 74 bytes (592 bits)
    [Frame is marked: False]
    [Frame is ignored: False]
    [Protocols in frame: eth:ethertype:ip:tcp]
Ethernet II, Src: 02:42:ac:11:00:04 (02:42:ac:11:00:04), Dst: 02:42:ac:11:00:05 (02:42:ac:11:00:05)
    Destination: 02:42:ac:11:00:05 (02:42:ac:11:00:05)
        Address: 02:42:ac:11:00:05 (02:42:ac:11:00:05)
        .... ..1. .... .... .... .... = LG bit: Locally administered address (this is NOT the factory default)
        .... ...0 .... .... .... .... = IG bit: Individual address (unicast)
    Source: 02:42:ac:11:00:04 (02:42:ac:11:00:04)
        Address: 02:42:ac:11:00:04 (02:42:ac:11:00:04)
        .... ..1. .... .... .... .... = LG bit: Locally administered address (this is NOT the factory default)
        .... ...0 .... .... .... .... = IG bit: Individual address (unicast)
    Type: IPv4 (0x0800)
Internet Protocol Version 4, Src: 172.17.0.4, Dst: 172.17.0.5
    0100 .... = Version: 4
    .... 0101 = Header Length: 20 bytes (5)
    Differentiated Services Field: 0x00 (DSCP: CS0, ECN: Not-ECT)
        0000 00.. = Differentiated Services Codepoint: Default (0)
        .... ..00 = Explicit Congestion Notification: Not ECN-Capable Transport (0)
    Total Length: 60
    Identification: 0x0371 (881)
    010. .... = Flags: 0x2, Don't fragment
        0... .... = Reserved bit: Not set
        .1.. .... = Don't fragment: Set
        ..0. .... = More fragments: Not set
    ...0 0000 0000 0000 = Fragment Offset: 0
    Time to Live: 64
    Protocol: TCP (6)
    Header Checksum: 0xdf1f [validation disabled]
    [Header checksum status: Unverified]
    Source Address: 172.17.0.4
    Destination Address: 172.17.0.5
Transmission Control Protocol, Src Port: 60058, Dst Port: 22, Seq: 0, Len: 0
    Source Port: 60058
    Destination Port: 22
    [Stream index: 0]
    [Conversation completeness: Incomplete (0)]
    [TCP Segment Len: 0]
    Sequence Number: 0    (relative sequence number)
    Sequence Number (raw): 3921465031
    [Next Sequence Number: 1    (relative sequence number)]
    Acknowledgment Number: 0
    Acknowledgment number (raw): 0
    1010 .... = Header Length: 40 bytes (10)
    Flags: 0x002 (SYN)
        000. .... .... = Reserved: Not set
        ...0 .... .... = Accurate ECN: Not set
        .... 0... .... = Congestion Window Reduced: Not set
        .... .0.. .... = ECN-Echo: Not set
        .... ..0. .... = Urgent: Not set
        .... ...0 .... = Acknowledgment: Not set
        .... .... 0... = Push: Not set
        .... .... .0.. = Reset: Not set
        .... .... ..1. = Syn: Set
            [Expert Info (Chat/Sequence): Connection establish request (SYN): server port 22]
                [Connection establish request (SYN): server port 22]
                [Severity level: Chat]
                [Group: Sequence]
        .... .... ...0 = Fin: Not set
        [TCP Flags: ··········S·]
    Window: 64240
    [Calculated window size: 64240]
    Checksum: 0x585a [unverified]
    [Checksum Status: Unverified]
    Urgent Pointer: 0
    Options: (20 bytes), Maximum segment size, SACK permitted, Timestamps, No-Operation (NOP), Window scale
        TCP Option - Maximum segment size: 1460 bytes
            Kind: Maximum Segment Size (2)
            Length: 4
            MSS Value: 1460
        TCP Option - SACK permitted
            Kind: SACK Permitted (4)
            Length: 2
        TCP Option - Timestamps
            Kind: Time Stamp Option (8)
            Length: 10
            Timestamp value: 64971304: TSval 64971304, TSecr 0
            Timestamp echo reply: 0
        TCP Option - No-Operation (NOP)
            Kind: No-Operation (1)
        TCP Option - Window scale: 7 (multiply by 128)
            Kind: Window Scale (3)
            Length: 3
            Shift count: 7
            [Multiplier: 128]
    [Timestamps]
        [Time since first frame in this TCP stream: 0.000000000 seconds]
        [Time since previous frame in this TCP stream: 0.000000000 seconds]

Frame 4: 74 bytes on wire (592 bits), 74 bytes captured (592 bits) on interface docker0, id 0
    Section number: 1
    Interface id: 0 (docker0)
        Interface name: docker0
    Encapsulation type: Ethernet (1)
    Arrival Time: Nov 21, 2023 22:06:01.233279686 -03
    [Time shift for this packet: 0.000000000 seconds]
    Epoch Time: 1700615161.233279686 seconds
    [Time delta from previous captured frame: 0.000022608 seconds]
    [Time delta from previous displayed frame: 0.000022608 seconds]
    [Time since reference or first frame: 0.000101877 seconds]
    Frame Number: 4
    Frame Length: 74 bytes (592 bits)
    Capture Length: 74 bytes (592 bits)
    [Frame is marked: False]
    [Frame is ignored: False]
    [Protocols in frame: eth:ethertype:ip:tcp]
Ethernet II, Src: 02:42:ac:11:00:05 (02:42:ac:11:00:05), Dst: 02:42:ac:11:00:04 (02:42:ac:11:00:04)
    Destination: 02:42:ac:11:00:04 (02:42:ac:11:00:04)
        Address: 02:42:ac:11:00:04 (02:42:ac:11:00:04)
        .... ..1. .... .... .... .... = LG bit: Locally administered address (this is NOT the factory default)
        .... ...0 .... .... .... .... = IG bit: Individual address (unicast)
    Source: 02:42:ac:11:00:05 (02:42:ac:11:00:05)
        Address: 02:42:ac:11:00:05 (02:42:ac:11:00:05)
        .... ..1. .... .... .... .... = LG bit: Locally administered address (this is NOT the factory default)
        .... ...0 .... .... .... .... = IG bit: Individual address (unicast)
    Type: IPv4 (0x0800)
Internet Protocol Version 4, Src: 172.17.0.5, Dst: 172.17.0.4
    0100 .... = Version: 4
    .... 0101 = Header Length: 20 bytes (5)
    Differentiated Services Field: 0x00 (DSCP: CS0, ECN: Not-ECT)
        0000 00.. = Differentiated Services Codepoint: Default (0)
        .... ..00 = Explicit Congestion Notification: Not ECN-Capable Transport (0)
    Total Length: 60
    Identification: 0x0000 (0)
    010. .... = Flags: 0x2, Don't fragment
        0... .... = Reserved bit: Not set
        .1.. .... = Don't fragment: Set
        ..0. .... = More fragments: Not set
    ...0 0000 0000 0000 = Fragment Offset: 0
    Time to Live: 64
    Protocol: TCP (6)
    Header Checksum: 0xe290 [validation disabled]
    [Header checksum status: Unverified]
    Source Address: 172.17.0.5
    Destination Address: 172.17.0.4
Transmission Control Protocol, Src Port: 22, Dst Port: 60058, Seq: 0, Ack: 1, Len: 0
    Source Port: 22
    Destination Port: 60058
    [Stream index: 0]
    [Conversation completeness: Incomplete, SYN_SENT (1)]
    [TCP Segment Len: 0]
    Sequence Number: 0    (relative sequence number)
    Sequence Number (raw): 3684715919
    [Next Sequence Number: 1    (relative sequence number)]
    Acknowledgment Number: 1    (relative ack number)
    Acknowledgment number (raw): 3921465032
    1010 .... = Header Length: 40 bytes (10)
    Flags: 0x012 (SYN, ACK)
        000. .... .... = Reserved: Not set
        ...0 .... .... = Accurate ECN: Not set
        .... 0... .... = Congestion Window Reduced: Not set
        .... .0.. .... = ECN-Echo: Not set
        .... ..0. .... = Urgent: Not set
        .... ...1 .... = Acknowledgment: Set
        .... .... 0... = Push: Not set
        .... .... .0.. = Reset: Not set
        .... .... ..1. = Syn: Set
            [Expert Info (Chat/Sequence): Connection establish acknowledge (SYN+ACK): server port 22]
                [Connection establish acknowledge (SYN+ACK): server port 22]
                [Severity level: Chat]
                [Group: Sequence]
        .... .... ...0 = Fin: Not set
        [TCP Flags: ·······A··S·]
    Window: 65160
    [Calculated window size: 65160]
    Checksum: 0x585a [unverified]
    [Checksum Status: Unverified]
    Urgent Pointer: 0
    Options: (20 bytes), Maximum segment size, SACK permitted, Timestamps, No-Operation (NOP), Window scale
        TCP Option - Maximum segment size: 1460 bytes
            Kind: Maximum Segment Size (2)
            Length: 4
            MSS Value: 1460
        TCP Option - SACK permitted
            Kind: SACK Permitted (4)
            Length: 2
        TCP Option - Timestamps
            Kind: Time Stamp Option (8)
            Length: 10
            Timestamp value: 2796060038: TSval 2796060038, TSecr 64971304
            Timestamp echo reply: 64971304
        TCP Option - No-Operation (NOP)
            Kind: No-Operation (1)
        TCP Option - Window scale: 7 (multiply by 128)
            Kind: Window Scale (3)
            Length: 3
            Shift count: 7
            [Multiplier: 128]
    [Timestamps]
        [Time since first frame in this TCP stream: 0.000022608 seconds]
        [Time since previous frame in this TCP stream: 0.000022608 seconds]
    [SEQ/ACK analysis]
        [This is an ACK to the segment in frame: 3]
        [The RTT to ACK the segment was: 0.000022608 seconds]

Frame 5: 66 bytes on wire (528 bits), 66 bytes captured (528 bits) on interface docker0, id 0
    Section number: 1
    Interface id: 0 (docker0)
        Interface name: docker0
    Encapsulation type: Ethernet (1)
    Arrival Time: Nov 21, 2023 22:06:01.233300719 -03
    [Time shift for this packet: 0.000000000 seconds]
    Epoch Time: 1700615161.233300719 seconds
    [Time delta from previous captured frame: 0.000021033 seconds]
    [Time delta from previous displayed frame: 0.000021033 seconds]
    [Time since reference or first frame: 0.000122910 seconds]
    Frame Number: 5
    Frame Length: 66 bytes (528 bits)
    Capture Length: 66 bytes (528 bits)
    [Frame is marked: False]
    [Frame is ignored: False]
    [Protocols in frame: eth:ethertype:ip:tcp]
Ethernet II, Src: 02:42:ac:11:00:04 (02:42:ac:11:00:04), Dst: 02:42:ac:11:00:05 (02:42:ac:11:00:05)
    Destination: 02:42:ac:11:00:05 (02:42:ac:11:00:05)
        Address: 02:42:ac:11:00:05 (02:42:ac:11:00:05)
        .... ..1. .... .... .... .... = LG bit: Locally administered address (this is NOT the factory default)
        .... ...0 .... .... .... .... = IG bit: Individual address (unicast)
    Source: 02:42:ac:11:00:04 (02:42:ac:11:00:04)
        Address: 02:42:ac:11:00:04 (02:42:ac:11:00:04)
        .... ..1. .... .... .... .... = LG bit: Locally administered address (this is NOT the factory default)
        .... ...0 .... .... .... .... = IG bit: Individual address (unicast)
    Type: IPv4 (0x0800)
Internet Protocol Version 4, Src: 172.17.0.4, Dst: 172.17.0.5
    0100 .... = Version: 4
    .... 0101 = Header Length: 20 bytes (5)
    Differentiated Services Field: 0x00 (DSCP: CS0, ECN: Not-ECT)
        0000 00.. = Differentiated Services Codepoint: Default (0)
        .... ..00 = Explicit Congestion Notification: Not ECN-Capable Transport (0)
    Total Length: 52
    Identification: 0x0372 (882)
    010. .... = Flags: 0x2, Don't fragment
        0... .... = Reserved bit: Not set
        .1.. .... = Don't fragment: Set
        ..0. .... = More fragments: Not set
    ...0 0000 0000 0000 = Fragment Offset: 0
    Time to Live: 64
    Protocol: TCP (6)
    Header Checksum: 0xdf26 [validation disabled]
    [Header checksum status: Unverified]
    Source Address: 172.17.0.4
    Destination Address: 172.17.0.5
Transmission Control Protocol, Src Port: 60058, Dst Port: 22, Seq: 1, Ack: 1, Len: 0
    Source Port: 60058
    Destination Port: 22
    [Stream index: 0]
    [Conversation completeness: Incomplete, CLIENT_ESTABLISHED (3)]
    [TCP Segment Len: 0]
    Sequence Number: 1    (relative sequence number)
    Sequence Number (raw): 3921465032
    [Next Sequence Number: 1    (relative sequence number)]
    Acknowledgment Number: 1    (relative ack number)
    Acknowledgment number (raw): 3684715920
    1000 .... = Header Length: 32 bytes (8)
    Flags: 0x010 (ACK)
        000. .... .... = Reserved: Not set
        ...0 .... .... = Accurate ECN: Not set
        .... 0... .... = Congestion Window Reduced: Not set
        .... .0.. .... = ECN-Echo: Not set
        .... ..0. .... = Urgent: Not set
        .... ...1 .... = Acknowledgment: Set
        .... .... 0... = Push: Not set
        .... .... .0.. = Reset: Not set
        .... .... ..0. = Syn: Not set
        .... .... ...0 = Fin: Not set
        [TCP Flags: ·······A····]
    Window: 502
    [Calculated window size: 64256]
    [Window size scaling factor: 128]
    Checksum: 0x5852 [unverified]
    [Checksum Status: Unverified]
    Urgent Pointer: 0
    Options: (12 bytes), No-Operation (NOP), No-Operation (NOP), Timestamps
        TCP Option - No-Operation (NOP)
            Kind: No-Operation (1)
        TCP Option - No-Operation (NOP)
            Kind: No-Operation (1)
        TCP Option - Timestamps
            Kind: Time Stamp Option (8)
            Length: 10
            Timestamp value: 64971304: TSval 64971304, TSecr 2796060038
            Timestamp echo reply: 2796060038
    [Timestamps]
        [Time since first frame in this TCP stream: 0.000043641 seconds]
        [Time since previous frame in this TCP stream: 0.000021033 seconds]
    [SEQ/ACK analysis]
        [This is an ACK to the segment in frame: 4]
        [The RTT to ACK the segment was: 0.000021033 seconds]
        [iRTT: 0.000043641 seconds]

Frame 6: 107 bytes on wire (856 bits), 107 bytes captured (856 bits) on interface docker0, id 0
    Section number: 1
    Interface id: 0 (docker0)
        Interface name: docker0
    Encapsulation type: Ethernet (1)
    Arrival Time: Nov 21, 2023 22:06:01.233773222 -03
    [Time shift for this packet: 0.000000000 seconds]
    Epoch Time: 1700615161.233773222 seconds
    [Time delta from previous captured frame: 0.000472503 seconds]
    [Time delta from previous displayed frame: 0.000472503 seconds]
    [Time since reference or first frame: 0.000595413 seconds]
    Frame Number: 6
    Frame Length: 107 bytes (856 bits)
    Capture Length: 107 bytes (856 bits)
    [Frame is marked: False]
    [Frame is ignored: False]
    [Protocols in frame: eth:ethertype:ip:tcp:ssh]
Ethernet II, Src: 02:42:ac:11:00:04 (02:42:ac:11:00:04), Dst: 02:42:ac:11:00:05 (02:42:ac:11:00:05)
    Destination: 02:42:ac:11:00:05 (02:42:ac:11:00:05)
        Address: 02:42:ac:11:00:05 (02:42:ac:11:00:05)
        .... ..1. .... .... .... .... = LG bit: Locally administered address (this is NOT the factory default)
        .... ...0 .... .... .... .... = IG bit: Individual address (unicast)
    Source: 02:42:ac:11:00:04 (02:42:ac:11:00:04)
        Address: 02:42:ac:11:00:04 (02:42:ac:11:00:04)
        .... ..1. .... .... .... .... = LG bit: Locally administered address (this is NOT the factory default)
        .... ...0 .... .... .... .... = IG bit: Individual address (unicast)
    Type: IPv4 (0x0800)
Internet Protocol Version 4, Src: 172.17.0.4, Dst: 172.17.0.5
    0100 .... = Version: 4
    .... 0101 = Header Length: 20 bytes (5)
    Differentiated Services Field: 0x00 (DSCP: CS0, ECN: Not-ECT)
        0000 00.. = Differentiated Services Codepoint: Default (0)
        .... ..00 = Explicit Congestion Notification: Not ECN-Capable Transport (0)
    Total Length: 93
    Identification: 0x0373 (883)
    010. .... = Flags: 0x2, Don't fragment
        0... .... = Reserved bit: Not set
        .1.. .... = Don't fragment: Set
        ..0. .... = More fragments: Not set
    ...0 0000 0000 0000 = Fragment Offset: 0
    Time to Live: 64
    Protocol: TCP (6)
    Header Checksum: 0xdefc [validation disabled]
    [Header checksum status: Unverified]
    Source Address: 172.17.0.4
    Destination Address: 172.17.0.5
Transmission Control Protocol, Src Port: 60058, Dst Port: 22, Seq: 1, Ack: 1, Len: 41
    Source Port: 60058
    Destination Port: 22
    [Stream index: 0]
    [Conversation completeness: Incomplete, ESTABLISHED (7)]
    [TCP Segment Len: 41]
    Sequence Number: 1    (relative sequence number)
    Sequence Number (raw): 3921465032
    [Next Sequence Number: 42    (relative sequence number)]
    Acknowledgment Number: 1    (relative ack number)
    Acknowledgment number (raw): 3684715920
    1000 .... = Header Length: 32 bytes (8)
    Flags: 0x018 (PSH, ACK)
        000. .... .... = Reserved: Not set
        ...0 .... .... = Accurate ECN: Not set
        .... 0... .... = Congestion Window Reduced: Not set
        .... .0.. .... = ECN-Echo: Not set
        .... ..0. .... = Urgent: Not set
        .... ...1 .... = Acknowledgment: Set
        .... .... 1... = Push: Set
        .... .... .0.. = Reset: Not set
        .... .... ..0. = Syn: Not set
        .... .... ...0 = Fin: Not set
        [TCP Flags: ·······AP···]
    Window: 502
    [Calculated window size: 64256]
    [Window size scaling factor: 128]
    Checksum: 0x587b [unverified]
    [Checksum Status: Unverified]
    Urgent Pointer: 0
    Options: (12 bytes), No-Operation (NOP), No-Operation (NOP), Timestamps
        TCP Option - No-Operation (NOP)
            Kind: No-Operation (1)
        TCP Option - No-Operation (NOP)
            Kind: No-Operation (1)
        TCP Option - Timestamps
            Kind: Time Stamp Option (8)
            Length: 10
            Timestamp value: 64971304: TSval 64971304, TSecr 2796060038
            Timestamp echo reply: 2796060038
    [Timestamps]
        [Time since first frame in this TCP stream: 0.000516144 seconds]
        [Time since previous frame in this TCP stream: 0.000472503 seconds]
    [SEQ/ACK analysis]
        [iRTT: 0.000043641 seconds]
        [Bytes in flight: 41]
        [Bytes sent since last PSH flag: 41]
    TCP payload (41 bytes)
SSH Protocol
    Protocol: SSH-2.0-OpenSSH_7.7p1 Ubuntu-4ubuntu0.3
    [Direction: client-to-server]

Frame 7: 66 bytes on wire (528 bits), 66 bytes captured (528 bits) on interface docker0, id 0
    Section number: 1
    Interface id: 0 (docker0)
        Interface name: docker0
    Encapsulation type: Ethernet (1)
    Arrival Time: Nov 21, 2023 22:06:01.233785739 -03
    [Time shift for this packet: 0.000000000 seconds]
    Epoch Time: 1700615161.233785739 seconds
    [Time delta from previous captured frame: 0.000012517 seconds]
    [Time delta from previous displayed frame: 0.000012517 seconds]
    [Time since reference or first frame: 0.000607930 seconds]
    Frame Number: 7
    Frame Length: 66 bytes (528 bits)
    Capture Length: 66 bytes (528 bits)
    [Frame is marked: False]
    [Frame is ignored: False]
    [Protocols in frame: eth:ethertype:ip:tcp]
Ethernet II, Src: 02:42:ac:11:00:05 (02:42:ac:11:00:05), Dst: 02:42:ac:11:00:04 (02:42:ac:11:00:04)
    Destination: 02:42:ac:11:00:04 (02:42:ac:11:00:04)
        Address: 02:42:ac:11:00:04 (02:42:ac:11:00:04)
        .... ..1. .... .... .... .... = LG bit: Locally administered address (this is NOT the factory default)
        .... ...0 .... .... .... .... = IG bit: Individual address (unicast)
    Source: 02:42:ac:11:00:05 (02:42:ac:11:00:05)
        Address: 02:42:ac:11:00:05 (02:42:ac:11:00:05)
        .... ..1. .... .... .... .... = LG bit: Locally administered address (this is NOT the factory default)
        .... ...0 .... .... .... .... = IG bit: Individual address (unicast)
    Type: IPv4 (0x0800)
Internet Protocol Version 4, Src: 172.17.0.5, Dst: 172.17.0.4
    0100 .... = Version: 4
    .... 0101 = Header Length: 20 bytes (5)
    Differentiated Services Field: 0x00 (DSCP: CS0, ECN: Not-ECT)
        0000 00.. = Differentiated Services Codepoint: Default (0)
        .... ..00 = Explicit Congestion Notification: Not ECN-Capable Transport (0)
    Total Length: 52
    Identification: 0x0979 (2425)
    010. .... = Flags: 0x2, Don't fragment
        0... .... = Reserved bit: Not set
        .1.. .... = Don't fragment: Set
        ..0. .... = More fragments: Not set
    ...0 0000 0000 0000 = Fragment Offset: 0
    Time to Live: 64
    Protocol: TCP (6)
    Header Checksum: 0xd91f [validation disabled]
    [Header checksum status: Unverified]
    Source Address: 172.17.0.5
    Destination Address: 172.17.0.4
Transmission Control Protocol, Src Port: 22, Dst Port: 60058, Seq: 1, Ack: 42, Len: 0
    Source Port: 22
    Destination Port: 60058
    [Stream index: 0]
    [Conversation completeness: Incomplete, DATA (15)]
    [TCP Segment Len: 0]
    Sequence Number: 1    (relative sequence number)
    Sequence Number (raw): 3684715920
    [Next Sequence Number: 1    (relative sequence number)]
    Acknowledgment Number: 42    (relative ack number)
    Acknowledgment number (raw): 3921465073
    1000 .... = Header Length: 32 bytes (8)
    Flags: 0x010 (ACK)
        000. .... .... = Reserved: Not set
        ...0 .... .... = Accurate ECN: Not set
        .... 0... .... = Congestion Window Reduced: Not set
        .... .0.. .... = ECN-Echo: Not set
        .... ..0. .... = Urgent: Not set
        .... ...1 .... = Acknowledgment: Set
        .... .... 0... = Push: Not set
        .... .... .0.. = Reset: Not set
        .... .... ..0. = Syn: Not set
        .... .... ...0 = Fin: Not set
        [TCP Flags: ·······A····]
    Window: 509
    [Calculated window size: 65152]
    [Window size scaling factor: 128]
    Checksum: 0x5852 [unverified]
    [Checksum Status: Unverified]
    Urgent Pointer: 0
    Options: (12 bytes), No-Operation (NOP), No-Operation (NOP), Timestamps
        TCP Option - No-Operation (NOP)
            Kind: No-Operation (1)
        TCP Option - No-Operation (NOP)
            Kind: No-Operation (1)
        TCP Option - Timestamps
            Kind: Time Stamp Option (8)
            Length: 10
            Timestamp value: 2796060038: TSval 2796060038, TSecr 64971304
            Timestamp echo reply: 64971304
    [Timestamps]
        [Time since first frame in this TCP stream: 0.000528661 seconds]
        [Time since previous frame in this TCP stream: 0.000012517 seconds]
    [SEQ/ACK analysis]
        [This is an ACK to the segment in frame: 6]
        [The RTT to ACK the segment was: 0.000012517 seconds]
        [iRTT: 0.000043641 seconds]

Frame 8: 107 bytes on wire (856 bits), 107 bytes captured (856 bits) on interface docker0, id 0
    Section number: 1
    Interface id: 0 (docker0)
        Interface name: docker0
    Encapsulation type: Ethernet (1)
    Arrival Time: Nov 21, 2023 22:06:01.243448995 -03
    [Time shift for this packet: 0.000000000 seconds]
    Epoch Time: 1700615161.243448995 seconds
    [Time delta from previous captured frame: 0.009663256 seconds]
    [Time delta from previous displayed frame: 0.009663256 seconds]
    [Time since reference or first frame: 0.010271186 seconds]
    Frame Number: 8
    Frame Length: 107 bytes (856 bits)
    Capture Length: 107 bytes (856 bits)
    [Frame is marked: False]
    [Frame is ignored: False]
    [Protocols in frame: eth:ethertype:ip:tcp:ssh]
Ethernet II, Src: 02:42:ac:11:00:05 (02:42:ac:11:00:05), Dst: 02:42:ac:11:00:04 (02:42:ac:11:00:04)
    Destination: 02:42:ac:11:00:04 (02:42:ac:11:00:04)
        Address: 02:42:ac:11:00:04 (02:42:ac:11:00:04)
        .... ..1. .... .... .... .... = LG bit: Locally administered address (this is NOT the factory default)
        .... ...0 .... .... .... .... = IG bit: Individual address (unicast)
    Source: 02:42:ac:11:00:05 (02:42:ac:11:00:05)
        Address: 02:42:ac:11:00:05 (02:42:ac:11:00:05)
        .... ..1. .... .... .... .... = LG bit: Locally administered address (this is NOT the factory default)
        .... ...0 .... .... .... .... = IG bit: Individual address (unicast)
    Type: IPv4 (0x0800)
Internet Protocol Version 4, Src: 172.17.0.5, Dst: 172.17.0.4
    0100 .... = Version: 4
    .... 0101 = Header Length: 20 bytes (5)
    Differentiated Services Field: 0x00 (DSCP: CS0, ECN: Not-ECT)
        0000 00.. = Differentiated Services Codepoint: Default (0)
        .... ..00 = Explicit Congestion Notification: Not ECN-Capable Transport (0)
    Total Length: 93
    Identification: 0x097a (2426)
    010. .... = Flags: 0x2, Don't fragment
        0... .... = Reserved bit: Not set
        .1.. .... = Don't fragment: Set
        ..0. .... = More fragments: Not set
    ...0 0000 0000 0000 = Fragment Offset: 0
    Time to Live: 64
    Protocol: TCP (6)
    Header Checksum: 0xd8f5 [validation disabled]
    [Header checksum status: Unverified]
    Source Address: 172.17.0.5
    Destination Address: 172.17.0.4
Transmission Control Protocol, Src Port: 22, Dst Port: 60058, Seq: 1, Ack: 42, Len: 41
    Source Port: 22
    Destination Port: 60058
    [Stream index: 0]
    [Conversation completeness: Incomplete, DATA (15)]
    [TCP Segment Len: 41]
    Sequence Number: 1    (relative sequence number)
    Sequence Number (raw): 3684715920
    [Next Sequence Number: 42    (relative sequence number)]
    Acknowledgment Number: 42    (relative ack number)
    Acknowledgment number (raw): 3921465073
    1000 .... = Header Length: 32 bytes (8)
    Flags: 0x018 (PSH, ACK)
        000. .... .... = Reserved: Not set
        ...0 .... .... = Accurate ECN: Not set
        .... 0... .... = Congestion Window Reduced: Not set
        .... .0.. .... = ECN-Echo: Not set
        .... ..0. .... = Urgent: Not set
        .... ...1 .... = Acknowledgment: Set
        .... .... 1... = Push: Set
        .... .... .0.. = Reset: Not set
        .... .... ..0. = Syn: Not set
        .... .... ...0 = Fin: Not set
        [TCP Flags: ·······AP···]
    Window: 509
    [Calculated window size: 65152]
    [Window size scaling factor: 128]
    Checksum: 0x587b [unverified]
    [Checksum Status: Unverified]
    Urgent Pointer: 0
    Options: (12 bytes), No-Operation (NOP), No-Operation (NOP), Timestamps
        TCP Option - No-Operation (NOP)
            Kind: No-Operation (1)
        TCP Option - No-Operation (NOP)
            Kind: No-Operation (1)
        TCP Option - Timestamps
            Kind: Time Stamp Option (8)
            Length: 10
            Timestamp value: 2796060048: TSval 2796060048, TSecr 64971304
            Timestamp echo reply: 64971304
    [Timestamps]
        [Time since first frame in this TCP stream: 0.010191917 seconds]
        [Time since previous frame in this TCP stream: 0.009663256 seconds]
    [SEQ/ACK analysis]
        [iRTT: 0.000043641 seconds]
        [Bytes in flight: 41]
        [Bytes sent since last PSH flag: 41]
    TCP payload (41 bytes)
SSH Protocol
    Protocol: SSH-2.0-OpenSSH_8.3p1 Ubuntu-1ubuntu0.1
    [Direction: server-to-client]

Frame 9: 66 bytes on wire (528 bits), 66 bytes captured (528 bits) on interface docker0, id 0
    Section number: 1
    Interface id: 0 (docker0)
        Interface name: docker0
    Encapsulation type: Ethernet (1)
    Arrival Time: Nov 21, 2023 22:06:01.243484020 -03
    [Time shift for this packet: 0.000000000 seconds]
    Epoch Time: 1700615161.243484020 seconds
    [Time delta from previous captured frame: 0.000035025 seconds]
    [Time delta from previous displayed frame: 0.000035025 seconds]
    [Time since reference or first frame: 0.010306211 seconds]
    Frame Number: 9
    Frame Length: 66 bytes (528 bits)
    Capture Length: 66 bytes (528 bits)
    [Frame is marked: False]
    [Frame is ignored: False]
    [Protocols in frame: eth:ethertype:ip:tcp]
Ethernet II, Src: 02:42:ac:11:00:04 (02:42:ac:11:00:04), Dst: 02:42:ac:11:00:05 (02:42:ac:11:00:05)
    Destination: 02:42:ac:11:00:05 (02:42:ac:11:00:05)
        Address: 02:42:ac:11:00:05 (02:42:ac:11:00:05)
        .... ..1. .... .... .... .... = LG bit: Locally administered address (this is NOT the factory default)
        .... ...0 .... .... .... .... = IG bit: Individual address (unicast)
    Source: 02:42:ac:11:00:04 (02:42:ac:11:00:04)
        Address: 02:42:ac:11:00:04 (02:42:ac:11:00:04)
        .... ..1. .... .... .... .... = LG bit: Locally administered address (this is NOT the factory default)
        .... ...0 .... .... .... .... = IG bit: Individual address (unicast)
    Type: IPv4 (0x0800)
Internet Protocol Version 4, Src: 172.17.0.4, Dst: 172.17.0.5
    0100 .... = Version: 4
    .... 0101 = Header Length: 20 bytes (5)
    Differentiated Services Field: 0x00 (DSCP: CS0, ECN: Not-ECT)
        0000 00.. = Differentiated Services Codepoint: Default (0)
        .... ..00 = Explicit Congestion Notification: Not ECN-Capable Transport (0)
    Total Length: 52
    Identification: 0x0374 (884)
    010. .... = Flags: 0x2, Don't fragment
        0... .... = Reserved bit: Not set
        .1.. .... = Don't fragment: Set
        ..0. .... = More fragments: Not set
    ...0 0000 0000 0000 = Fragment Offset: 0
    Time to Live: 64
    Protocol: TCP (6)
    Header Checksum: 0xdf24 [validation disabled]
    [Header checksum status: Unverified]
    Source Address: 172.17.0.4
    Destination Address: 172.17.0.5
Transmission Control Protocol, Src Port: 60058, Dst Port: 22, Seq: 42, Ack: 42, Len: 0
    Source Port: 60058
    Destination Port: 22
    [Stream index: 0]
    [Conversation completeness: Incomplete, DATA (15)]
    [TCP Segment Len: 0]
    Sequence Number: 42    (relative sequence number)
    Sequence Number (raw): 3921465073
    [Next Sequence Number: 42    (relative sequence number)]
    Acknowledgment Number: 42    (relative ack number)
    Acknowledgment number (raw): 3684715961
    1000 .... = Header Length: 32 bytes (8)
    Flags: 0x010 (ACK)
        000. .... .... = Reserved: Not set
        ...0 .... .... = Accurate ECN: Not set
        .... 0... .... = Congestion Window Reduced: Not set
        .... .0.. .... = ECN-Echo: Not set
        .... ..0. .... = Urgent: Not set
        .... ...1 .... = Acknowledgment: Set
        .... .... 0... = Push: Not set
        .... .... .0.. = Reset: Not set
        .... .... ..0. = Syn: Not set
        .... .... ...0 = Fin: Not set
        [TCP Flags: ·······A····]
    Window: 502
    [Calculated window size: 64256]
    [Window size scaling factor: 128]
    Checksum: 0x5852 [unverified]
    [Checksum Status: Unverified]
    Urgent Pointer: 0
    Options: (12 bytes), No-Operation (NOP), No-Operation (NOP), Timestamps
        TCP Option - No-Operation (NOP)
            Kind: No-Operation (1)
        TCP Option - No-Operation (NOP)
            Kind: No-Operation (1)
        TCP Option - Timestamps
            Kind: Time Stamp Option (8)
            Length: 10
            Timestamp value: 64971314: TSval 64971314, TSecr 2796060048
            Timestamp echo reply: 2796060048
    [Timestamps]
        [Time since first frame in this TCP stream: 0.010226942 seconds]
        [Time since previous frame in this TCP stream: 0.000035025 seconds]
    [SEQ/ACK analysis]
        [This is an ACK to the segment in frame: 8]
        [The RTT to ACK the segment was: 0.000035025 seconds]
        [iRTT: 0.000043641 seconds]

Frame 10: 1426 bytes on wire (11408 bits), 1426 bytes captured (11408 bits) on interface docker0, id 0
    Section number: 1
    Interface id: 0 (docker0)
        Interface name: docker0
    Encapsulation type: Ethernet (1)
    Arrival Time: Nov 21, 2023 22:06:01.244317514 -03
    [Time shift for this packet: 0.000000000 seconds]
    Epoch Time: 1700615161.244317514 seconds
    [Time delta from previous captured frame: 0.000833494 seconds]
    [Time delta from previous displayed frame: 0.000833494 seconds]
    [Time since reference or first frame: 0.011139705 seconds]
    Frame Number: 10
    Frame Length: 1426 bytes (11408 bits)
    Capture Length: 1426 bytes (11408 bits)
    [Frame is marked: False]
    [Frame is ignored: False]
    [Protocols in frame: eth:ethertype:ip:tcp:ssh]
Ethernet II, Src: 02:42:ac:11:00:04 (02:42:ac:11:00:04), Dst: 02:42:ac:11:00:05 (02:42:ac:11:00:05)
    Destination: 02:42:ac:11:00:05 (02:42:ac:11:00:05)
        Address: 02:42:ac:11:00:05 (02:42:ac:11:00:05)
        .... ..1. .... .... .... .... = LG bit: Locally administered address (this is NOT the factory default)
        .... ...0 .... .... .... .... = IG bit: Individual address (unicast)
    Source: 02:42:ac:11:00:04 (02:42:ac:11:00:04)
        Address: 02:42:ac:11:00:04 (02:42:ac:11:00:04)
        .... ..1. .... .... .... .... = LG bit: Locally administered address (this is NOT the factory default)
        .... ...0 .... .... .... .... = IG bit: Individual address (unicast)
    Type: IPv4 (0x0800)
Internet Protocol Version 4, Src: 172.17.0.4, Dst: 172.17.0.5
    0100 .... = Version: 4
    .... 0101 = Header Length: 20 bytes (5)
    Differentiated Services Field: 0x00 (DSCP: CS0, ECN: Not-ECT)
        0000 00.. = Differentiated Services Codepoint: Default (0)
        .... ..00 = Explicit Congestion Notification: Not ECN-Capable Transport (0)
    Total Length: 1412
    Identification: 0x0375 (885)
    010. .... = Flags: 0x2, Don't fragment
        0... .... = Reserved bit: Not set
        .1.. .... = Don't fragment: Set
        ..0. .... = More fragments: Not set
    ...0 0000 0000 0000 = Fragment Offset: 0
    Time to Live: 64
    Protocol: TCP (6)
    Header Checksum: 0xd9d3 [validation disabled]
    [Header checksum status: Unverified]
    Source Address: 172.17.0.4
    Destination Address: 172.17.0.5
Transmission Control Protocol, Src Port: 60058, Dst Port: 22, Seq: 42, Ack: 42, Len: 1360
    Source Port: 60058
    Destination Port: 22
    [Stream index: 0]
    [Conversation completeness: Incomplete, DATA (15)]
    [TCP Segment Len: 1360]
    Sequence Number: 42    (relative sequence number)
    Sequence Number (raw): 3921465073
    [Next Sequence Number: 1402    (relative sequence number)]
    Acknowledgment Number: 42    (relative ack number)
    Acknowledgment number (raw): 3684715961
    1000 .... = Header Length: 32 bytes (8)
    Flags: 0x018 (PSH, ACK)
        000. .... .... = Reserved: Not set
        ...0 .... .... = Accurate ECN: Not set
        .... 0... .... = Congestion Window Reduced: Not set
        .... .0.. .... = ECN-Echo: Not set
        .... ..0. .... = Urgent: Not set
        .... ...1 .... = Acknowledgment: Set
        .... .... 1... = Push: Set
        .... .... .0.. = Reset: Not set
        .... .... ..0. = Syn: Not set
        .... .... ...0 = Fin: Not set
        [TCP Flags: ·······AP···]
    Window: 502
    [Calculated window size: 64256]
    [Window size scaling factor: 128]
    Checksum: 0x5da2 [unverified]
    [Checksum Status: Unverified]
    Urgent Pointer: 0
    Options: (12 bytes), No-Operation (NOP), No-Operation (NOP), Timestamps
        TCP Option - No-Operation (NOP)
            Kind: No-Operation (1)
        TCP Option - No-Operation (NOP)
            Kind: No-Operation (1)
        TCP Option - Timestamps
            Kind: Time Stamp Option (8)
            Length: 10
            Timestamp value: 64971315: TSval 64971315, TSecr 2796060048
            Timestamp echo reply: 2796060048
    [Timestamps]
        [Time since first frame in this TCP stream: 0.011060436 seconds]
        [Time since previous frame in this TCP stream: 0.000833494 seconds]
    [SEQ/ACK analysis]
        [iRTT: 0.000043641 seconds]
        [Bytes in flight: 1360]
        [Bytes sent since last PSH flag: 1360]
    TCP payload (1360 bytes)
SSH Protocol
    SSH Version 2
        Packet Length: 1356
        Padding Length: 5
        Key Exchange
            Message Code: Key Exchange Init (20)
            Algorithms
                Cookie: a73ce0ac81c8f211c123ec8c838ec25c
                kex_algorithms length: 304
                kex_algorithms string [truncated]: curve25519-sha256,curve25519-sha256@libssh.org,ecdh-sha2-nistp256,ecdh-sha2-nistp384,ecdh-sha2-nistp521,diffie-hellman-group-exchange-sha256,diffie-hellman-group16-sha512,diffie-hellman-group18-sha512,di
                server_host_key_algorithms length: 290
                server_host_key_algorithms string [truncated]: ecdsa-sha2-nistp256-cert-v01@openssh.com,ecdsa-sha2-nistp384-cert-v01@openssh.com,ecdsa-sha2-nistp521-cert-v01@openssh.com,ssh-ed25519-cert-v01@openssh.com,ssh-rsa-cert-v01@openssh.com,ecdsa-
                encryption_algorithms_client_to_server length: 108
