Frame 1: 74 bytes on wire (592 bits), 74 bytes captured (592 bits) on interface lo, id 0
    Section number: 1
    Interface id: 0 (lo)
        Interface name: lo
    Encapsulation type: Ethernet (1)
    Arrival Time: Nov 21, 2023 22:28:39.729112107 -03
    [Time shift for this packet: 0.000000000 seconds]
    Epoch Time: 1700616519.729112107 seconds
    [Time delta from previous captured frame: 0.000000000 seconds]
    [Time delta from previous displayed frame: 0.000000000 seconds]
    [Time since reference or first frame: 0.000000000 seconds]
    Frame Number: 1
    Frame Length: 74 bytes (592 bits)
    Capture Length: 74 bytes (592 bits)
    [Frame is marked: False]
    [Frame is ignored: False]
    [Protocols in frame: eth:ethertype:ip:tcp]
Ethernet II, Src: 00:00:00_00:00:00 (00:00:00:00:00:00), Dst: 00:00:00_00:00:00 (00:00:00:00:00:00)
    Destination: 00:00:00_00:00:00 (00:00:00:00:00:00)
        Address: 00:00:00_00:00:00 (00:00:00:00:00:00)
        .... ..0. .... .... .... .... = LG bit: Globally unique address (factory default)
        .... ...0 .... .... .... .... = IG bit: Individual address (unicast)
    Source: 00:00:00_00:00:00 (00:00:00:00:00:00)
        Address: 00:00:00_00:00:00 (00:00:00:00:00:00)
        .... ..0. .... .... .... .... = LG bit: Globally unique address (factory default)
        .... ...0 .... .... .... .... = IG bit: Individual address (unicast)
    Type: IPv4 (0x0800)
Internet Protocol Version 4, Src: 127.0.0.1, Dst: 127.0.0.1
    0100 .... = Version: 4
    .... 0101 = Header Length: 20 bytes (5)
    Differentiated Services Field: 0x00 (DSCP: CS0, ECN: Not-ECT)
        0000 00.. = Differentiated Services Codepoint: Default (0)
        .... ..00 = Explicit Congestion Notification: Not ECN-Capable Transport (0)
    Total Length: 60
    Identification: 0xf4f4 (62708)
    010. .... = Flags: 0x2, Don't fragment
        0... .... = Reserved bit: Not set
        .1.. .... = Don't fragment: Set
        ..0. .... = More fragments: Not set
    ...0 0000 0000 0000 = Fragment Offset: 0
    Time to Live: 64
    Protocol: TCP (6)
    Header Checksum: 0x47c5 [validation disabled]
    [Header checksum status: Unverified]
    Source Address: 127.0.0.1
    Destination Address: 127.0.0.1
Transmission Control Protocol, Src Port: 49928, Dst Port: 22, Seq: 0, Len: 0
    Source Port: 49928
    Destination Port: 22
    [Stream index: 0]
    [Conversation completeness: Incomplete (0)]
    [TCP Segment Len: 0]
    Sequence Number: 0    (relative sequence number)
    Sequence Number (raw): 2205139329
    [Next Sequence Number: 1    (relative sequence number)]
    Acknowledgment Number: 0
    Acknowledgment number (raw): 0
    1010 .... = Header Length: 40 bytes (10)
    Flags: 0x002 (SYN)
        000. .... .... = Reserved: Not set
        ...0 .... .... = Accurate ECN: Not set
        .... 0... .... = Congestion Window Reduced: Not set
        .... .0.. .... = ECN-Echo: Not set
        .... ..0. .... = Urgent: Not set
        .... ...0 .... = Acknowledgment: Not set
        .... .... 0... = Push: Not set
        .... .... .0.. = Reset: Not set
        .... .... ..1. = Syn: Set
            [Expert Info (Chat/Sequence): Connection establish request (SYN): server port 22]
                [Connection establish request (SYN): server port 22]
                [Severity level: Chat]
                [Group: Sequence]
        .... .... ...0 = Fin: Not set
        [TCP Flags: ··········S·]
    Window: 65495
    [Calculated window size: 65495]
    Checksum: 0xfe30 [unverified]
    [Checksum Status: Unverified]
    Urgent Pointer: 0
    Options: (20 bytes), Maximum segment size, SACK permitted, Timestamps, No-Operation (NOP), Window scale
        TCP Option - Maximum segment size: 65495 bytes
            Kind: Maximum Segment Size (2)
            Length: 4
            MSS Value: 65495
        TCP Option - SACK permitted
            Kind: SACK Permitted (4)
            Length: 2
        TCP Option - Timestamps
            Kind: Time Stamp Option (8)
            Length: 10
            Timestamp value: 2188730760: TSval 2188730760, TSecr 0
            Timestamp echo reply: 0
        TCP Option - No-Operation (NOP)
            Kind: No-Operation (1)
        TCP Option - Window scale: 7 (multiply by 128)
            Kind: Window Scale (3)
            Length: 3
            Shift count: 7
            [Multiplier: 128]
    [Timestamps]
        [Time since first frame in this TCP stream: 0.000000000 seconds]
        [Time since previous frame in this TCP stream: 0.000000000 seconds]

Frame 2: 74 bytes on wire (592 bits), 74 bytes captured (592 bits) on interface lo, id 0
    Section number: 1
    Interface id: 0 (lo)
        Interface name: lo
    Encapsulation type: Ethernet (1)
    Arrival Time: Nov 21, 2023 22:28:39.729134787 -03
    [Time shift for this packet: 0.000000000 seconds]
    Epoch Time: 1700616519.729134787 seconds
    [Time delta from previous captured frame: 0.000022680 seconds]
    [Time delta from previous displayed frame: 0.000022680 seconds]
    [Time since reference or first frame: 0.000022680 seconds]
    Frame Number: 2
    Frame Length: 74 bytes (592 bits)
    Capture Length: 74 bytes (592 bits)
    [Frame is marked: False]
    [Frame is ignored: False]
    [Protocols in frame: eth:ethertype:ip:tcp]
Ethernet II, Src: 00:00:00_00:00:00 (00:00:00:00:00:00), Dst: 00:00:00_00:00:00 (00:00:00:00:00:00)
    Destination: 00:00:00_00:00:00 (00:00:00:00:00:00)
        Address: 00:00:00_00:00:00 (00:00:00:00:00:00)
        .... ..0. .... .... .... .... = LG bit: Globally unique address (factory default)
        .... ...0 .... .... .... .... = IG bit: Individual address (unicast)
    Source: 00:00:00_00:00:00 (00:00:00:00:00:00)
        Address: 00:00:00_00:00:00 (00:00:00:00:00:00)
        .... ..0. .... .... .... .... = LG bit: Globally unique address (factory default)
        .... ...0 .... .... .... .... = IG bit: Individual address (unicast)
    Type: IPv4 (0x0800)
Internet Protocol Version 4, Src: 127.0.0.1, Dst: 127.0.0.1
    0100 .... = Version: 4
    .... 0101 = Header Length: 20 bytes (5)
    Differentiated Services Field: 0x00 (DSCP: CS0, ECN: Not-ECT)
        0000 00.. = Differentiated Services Codepoint: Default (0)
        .... ..00 = Explicit Congestion Notification: Not ECN-Capable Transport (0)
    Total Length: 60
    Identification: 0x0000 (0)
    010. .... = Flags: 0x2, Don't fragment
        0... .... = Reserved bit: Not set
        .1.. .... = Don't fragment: Set
        ..0. .... = More fragments: Not set
    ...0 0000 0000 0000 = Fragment Offset: 0
    Time to Live: 64
    Protocol: TCP (6)
    Header Checksum: 0x3cba [validation disabled]
    [Header checksum status: Unverified]
    Source Address: 127.0.0.1
    Destination Address: 127.0.0.1
Transmission Control Protocol, Src Port: 22, Dst Port: 49928, Seq: 0, Ack: 1, Len: 0
    Source Port: 22
    Destination Port: 49928
    [Stream index: 0]
    [Conversation completeness: Incomplete, SYN_SENT (1)]
    [TCP Segment Len: 0]
    Sequence Number: 0    (relative sequence number)
    Sequence Number (raw): 3154420720
    [Next Sequence Number: 1    (relative sequence number)]
    Acknowledgment Number: 1    (relative ack number)
    Acknowledgment number (raw): 2205139330
    1010 .... = Header Length: 40 bytes (10)
    Flags: 0x012 (SYN, ACK)
        000. .... .... = Reserved: Not set
        ...0 .... .... = Accurate ECN: Not set
        .... 0... .... = Congestion Window Reduced: Not set
        .... .0.. .... = ECN-Echo: Not set
        .... ..0. .... = Urgent: Not set
        .... ...1 .... = Acknowledgment: Set
        .... .... 0... = Push: Not set
        .... .... .0.. = Reset: Not set
        .... .... ..1. = Syn: Set
            [Expert Info (Chat/Sequence): Connection establish acknowledge (SYN+ACK): server port 22]
                [Connection establish acknowledge (SYN+ACK): server port 22]
                [Severity level: Chat]
                [Group: Sequence]
        .... .... ...0 = Fin: Not set
        [TCP Flags: ·······A··S·]
    Window: 65483
    [Calculated window size: 65483]
    Checksum: 0xfe30 [unverified]
    [Checksum Status: Unverified]
    Urgent Pointer: 0
    Options: (20 bytes), Maximum segment size, SACK permitted, Timestamps, No-Operation (NOP), Window scale
        TCP Option - Maximum segment size: 65495 bytes
            Kind: Maximum Segment Size (2)
            Length: 4
            MSS Value: 65495
        TCP Option - SACK permitted
            Kind: SACK Permitted (4)
            Length: 2
        TCP Option - Timestamps
            Kind: Time Stamp Option (8)
            Length: 10
            Timestamp value: 2188730760: TSval 2188730760, TSecr 2188730760
            Timestamp echo reply: 2188730760
        TCP Option - No-Operation (NOP)
            Kind: No-Operation (1)
        TCP Option - Window scale: 7 (multiply by 128)
            Kind: Window Scale (3)
            Length: 3
            Shift count: 7
            [Multiplier: 128]
    [Timestamps]
        [Time since first frame in this TCP stream: 0.000022680 seconds]
        [Time since previous frame in this TCP stream: 0.000022680 seconds]
    [SEQ/ACK analysis]
        [This is an ACK to the segment in frame: 1]
        [The RTT to ACK the segment was: 0.000022680 seconds]

Frame 3: 66 bytes on wire (528 bits), 66 bytes captured (528 bits) on interface lo, id 0
    Section number: 1
    Interface id: 0 (lo)
        Interface name: lo
    Encapsulation type: Ethernet (1)
    Arrival Time: Nov 21, 2023 22:28:39.729158687 -03
    [Time shift for this packet: 0.000000000 seconds]
    Epoch Time: 1700616519.729158687 seconds
    [Time delta from previous captured frame: 0.000023900 seconds]
    [Time delta from previous displayed frame: 0.000023900 seconds]
    [Time since reference or first frame: 0.000046580 seconds]
    Frame Number: 3
    Frame Length: 66 bytes (528 bits)
    Capture Length: 66 bytes (528 bits)
    [Frame is marked: False]
    [Frame is ignored: False]
    [Protocols in frame: eth:ethertype:ip:tcp]
Ethernet II, Src: 00:00:00_00:00:00 (00:00:00:00:00:00), Dst: 00:00:00_00:00:00 (00:00:00:00:00:00)
    Destination: 00:00:00_00:00:00 (00:00:00:00:00:00)
        Address: 00:00:00_00:00:00 (00:00:00:00:00:00)
        .... ..0. .... .... .... .... = LG bit: Globally unique address (factory default)
        .... ...0 .... .... .... .... = IG bit: Individual address (unicast)
    Source: 00:00:00_00:00:00 (00:00:00:00:00:00)
        Address: 00:00:00_00:00:00 (00:00:00:00:00:00)
        .... ..0. .... .... .... .... = LG bit: Globally unique address (factory default)
        .... ...0 .... .... .... .... = IG bit: Individual address (unicast)
    Type: IPv4 (0x0800)
Internet Protocol Version 4, Src: 127.0.0.1, Dst: 127.0.0.1
    0100 .... = Version: 4
    .... 0101 = Header Length: 20 bytes (5)
    Differentiated Services Field: 0x00 (DSCP: CS0, ECN: Not-ECT)
        0000 00.. = Differentiated Services Codepoint: Default (0)
        .... ..00 = Explicit Congestion Notification: Not ECN-Capable Transport (0)
    Total Length: 52
    Identification: 0xf4f5 (62709)
    010. .... = Flags: 0x2, Don't fragment
        0... .... = Reserved bit: Not set
        .1.. .... = Don't fragment: Set
        ..0. .... = More fragments: Not set
    ...0 0000 0000 0000 = Fragment Offset: 0
    Time to Live: 64
    Protocol: TCP (6)
    Header Checksum: 0x47cc [validation disabled]
    [Header checksum status: Unverified]
    Source Address: 127.0.0.1
    Destination Address: 127.0.0.1
Transmission Control Protocol, Src Port: 49928, Dst Port: 22, Seq: 1, Ack: 1, Len: 0
    Source Port: 49928
    Destination Port: 22
    [Stream index: 0]
    [Conversation completeness: Incomplete, CLIENT_ESTABLISHED (3)]
    [TCP Segment Len: 0]
    Sequence Number: 1    (relative sequence number)
    Sequence Number (raw): 2205139330
    [Next Sequence Number: 1    (relative sequence number)]
    Acknowledgment Number: 1    (relative ack number)
    Acknowledgment number (raw): 3154420721
    1000 .... = Header Length: 32 bytes (8)
    Flags: 0x010 (ACK)
        000. .... .... = Reserved: Not set
        ...0 .... .... = Accurate ECN: Not set
        .... 0... .... = Congestion Window Reduced: Not set
        .... .0.. .... = ECN-Echo: Not set
        .... ..0. .... = Urgent: Not set
        .... ...1 .... = Acknowledgment: Set
        .... .... 0... = Push: Not set
        .... .... .0.. = Reset: Not set
        .... .... ..0. = Syn: Not set
        .... .... ...0 = Fin: Not set
        [TCP Flags: ·······A····]
    Window: 512
    [Calculated window size: 65536]
    [Window size scaling factor: 128]
    Checksum: 0xfe28 [unverified]
    [Checksum Status: Unverified]
    Urgent Pointer: 0
    Options: (12 bytes), No-Operation (NOP), No-Operation (NOP), Timestamps
        TCP Option - No-Operation (NOP)
            Kind: No-Operation (1)
        TCP Option - No-Operation (NOP)
            Kind: No-Operation (1)
        TCP Option - Timestamps
            Kind: Time Stamp Option (8)
            Length: 10
            Timestamp value: 2188730760: TSval 2188730760, TSecr 2188730760
            Timestamp echo reply: 2188730760
    [Timestamps]
        [Time since first frame in this TCP stream: 0.000046580 seconds]
        [Time since previous frame in this TCP stream: 0.000023900 seconds]
    [SEQ/ACK analysis]
        [This is an ACK to the segment in frame: 2]
        [The RTT to ACK the segment was: 0.000023900 seconds]
        [iRTT: 0.000046580 seconds]

Frame 4: 107 bytes on wire (856 bits), 107 bytes captured (856 bits) on interface lo, id 0
    Section number: 1
    Interface id: 0 (lo)
        Interface name: lo
    Encapsulation type: Ethernet (1)
    Arrival Time: Nov 21, 2023 22:28:39.730526234 -03
    [Time shift for this packet: 0.000000000 seconds]
    Epoch Time: 1700616519.730526234 seconds
    [Time delta from previous captured frame: 0.001367547 seconds]
    [Time delta from previous displayed frame: 0.001367547 seconds]
    [Time since reference or first frame: 0.001414127 seconds]
    Frame Number: 4
    Frame Length: 107 bytes (856 bits)
    Capture Length: 107 bytes (856 bits)
    [Frame is marked: False]
    [Frame is ignored: False]
    [Protocols in frame: eth:ethertype:ip:tcp:ssh]
Ethernet II, Src: 00:00:00_00:00:00 (00:00:00:00:00:00), Dst: 00:00:00_00:00:00 (00:00:00:00:00:00)
    Destination: 00:00:00_00:00:00 (00:00:00:00:00:00)
        Address: 00:00:00_00:00:00 (00:00:00:00:00:00)
        .... ..0. .... .... .... .... = LG bit: Globally unique address (factory default)
        .... ...0 .... .... .... .... = IG bit: Individual address (unicast)
    Source: 00:00:00_00:00:00 (00:00:00:00:00:00)
        Address: 00:00:00_00:00:00 (00:00:00:00:00:00)
        .... ..0. .... .... .... .... = LG bit: Globally unique address (factory default)
        .... ...0 .... .... .... .... = IG bit: Individual address (unicast)
    Type: IPv4 (0x0800)
Internet Protocol Version 4, Src: 127.0.0.1, Dst: 127.0.0.1
    0100 .... = Version: 4
    .... 0101 = Header Length: 20 bytes (5)
    Differentiated Services Field: 0x00 (DSCP: CS0, ECN: Not-ECT)
        0000 00.. = Differentiated Services Codepoint: Default (0)
        .... ..00 = Explicit Congestion Notification: Not ECN-Capable Transport (0)
    Total Length: 93
    Identification: 0xf4f6 (62710)
    010. .... = Flags: 0x2, Don't fragment
        0... .... = Reserved bit: Not set
        .1.. .... = Don't fragment: Set
        ..0. .... = More fragments: Not set
    ...0 0000 0000 0000 = Fragment Offset: 0
    Time to Live: 64
    Protocol: TCP (6)
    Header Checksum: 0x47a2 [validation disabled]
    [Header checksum status: Unverified]
    Source Address: 127.0.0.1
    Destination Address: 127.0.0.1
Transmission Control Protocol, Src Port: 49928, Dst Port: 22, Seq: 1, Ack: 1, Len: 41
    Source Port: 49928
    Destination Port: 22
    [Stream index: 0]
    [Conversation completeness: Incomplete, ESTABLISHED (7)]
    [TCP Segment Len: 41]
    Sequence Number: 1    (relative sequence number)
    Sequence Number (raw): 2205139330
    [Next Sequence Number: 42    (relative sequence number)]
    Acknowledgment Number: 1    (relative ack number)
    Acknowledgment number (raw): 3154420721
    1000 .... = Header Length: 32 bytes (8)
    Flags: 0x018 (PSH, ACK)
        000. .... .... = Reserved: Not set
        ...0 .... .... = Accurate ECN: Not set
        .... 0... .... = Congestion Window Reduced: Not set
        .... .0.. .... = ECN-Echo: Not set
        .... ..0. .... = Urgent: Not set
        .... ...1 .... = Acknowledgment: Set
        .... .... 1... = Push: Set
        .... .... .0.. = Reset: Not set
        .... .... ..0. = Syn: Not set
        .... .... ...0 = Fin: Not set
        [TCP Flags: ·······AP···]
    Window: 512
    [Calculated window size: 65536]
    [Window size scaling factor: 128]
    Checksum: 0xfe51 [unverified]
    [Checksum Status: Unverified]
    Urgent Pointer: 0
    Options: (12 bytes), No-Operation (NOP), No-Operation (NOP), Timestamps
        TCP Option - No-Operation (NOP)
            Kind: No-Operation (1)
        TCP Option - No-Operation (NOP)
            Kind: No-Operation (1)
        TCP Option - Timestamps
            Kind: Time Stamp Option (8)
            Length: 10
            Timestamp value: 2188730761: TSval 2188730761, TSecr 2188730760
            Timestamp echo reply: 2188730760
    [Timestamps]
        [Time since first frame in this TCP stream: 0.001414127 seconds]
        [Time since previous frame in this TCP stream: 0.001367547 seconds]
    [SEQ/ACK analysis]
        [iRTT: 0.000046580 seconds]
        [Bytes in flight: 41]
        [Bytes sent since last PSH flag: 41]
    TCP payload (41 bytes)
SSH Protocol
    Protocol: SSH-2.0-OpenSSH_8.3p1 Ubuntu-1ubuntu0.1
    [Direction: client-to-server]

Frame 5: 66 bytes on wire (528 bits), 66 bytes captured (528 bits) on interface lo, id 0
    Section number: 1
    Interface id: 0 (lo)
        Interface name: lo
    Encapsulation type: Ethernet (1)
    Arrival Time: Nov 21, 2023 22:28:39.730539033 -03
    [Time shift for this packet: 0.000000000 seconds]
    Epoch Time: 1700616519.730539033 seconds
    [Time delta from previous captured frame: 0.000012799 seconds]
    [Time delta from previous displayed frame: 0.000012799 seconds]
    [Time since reference or first frame: 0.001426926 seconds]
    Frame Number: 5
    Frame Length: 66 bytes (528 bits)
    Capture Length: 66 bytes (528 bits)
    [Frame is marked: False]
    [Frame is ignored: False]
    [Protocols in frame: eth:ethertype:ip:tcp]
Ethernet II, Src: 00:00:00_00:00:00 (00:00:00:00:00:00), Dst: 00:00:00_00:00:00 (00:00:00:00:00:00)
    Destination: 00:00:00_00:00:00 (00:00:00:00:00:00)
        Address: 00:00:00_00:00:00 (00:00:00:00:00:00)
        .... ..0. .... .... .... .... = LG bit: Globally unique address (factory default)
        .... ...0 .... .... .... .... = IG bit: Individual address (unicast)
    Source: 00:00:00_00:00:00 (00:00:00:00:00:00)
        Address: 00:00:00_00:00:00 (00:00:00:00:00:00)
        .... ..0. .... .... .... .... = LG bit: Globally unique address (factory default)
        .... ...0 .... .... .... .... = IG bit: Individual address (unicast)
    Type: IPv4 (0x0800)
Internet Protocol Version 4, Src: 127.0.0.1, Dst: 127.0.0.1
    0100 .... = Version: 4
    .... 0101 = Header Length: 20 bytes (5)
    Differentiated Services Field: 0x00 (DSCP: CS0, ECN: Not-ECT)
        0000 00.. = Differentiated Services Codepoint: Default (0)
        .... ..00 = Explicit Congestion Notification: Not ECN-Capable Transport (0)
    Total Length: 52
    Identification: 0xa944 (43332)
    010. .... = Flags: 0x2, Don't fragment
        0... .... = Reserved bit: Not set
        .1.. .... = Don't fragment: Set
        ..0. .... = More fragments: Not set
    ...0 0000 0000 0000 = Fragment Offset: 0
    Time to Live: 64
    Protocol: TCP (6)
    Header Checksum: 0x937d [validation disabled]
    [Header checksum status: Unverified]
    Source Address: 127.0.0.1
    Destination Address: 127.0.0.1
Transmission Control Protocol, Src Port: 22, Dst Port: 49928, Seq: 1, Ack: 42, Len: 0
    Source Port: 22
    Destination Port: 49928
    [Stream index: 0]
    [Conversation completeness: Incomplete, DATA (15)]
    [TCP Segment Len: 0]
    Sequence Number: 1    (relative sequence number)
    Sequence Number (raw): 3154420721
    [Next Sequence Number: 1    (relative sequence number)]
    Acknowledgment Number: 42    (relative ack number)
    Acknowledgment number (raw): 2205139371
    1000 .... = Header Length: 32 bytes (8)
    Flags: 0x010 (ACK)
        000. .... .... = Reserved: Not set
        ...0 .... .... = Accurate ECN: Not set
        .... 0... .... = Congestion Window Reduced: Not set
        .... .0.. .... = ECN-Echo: Not set
        .... ..0. .... = Urgent: Not set
        .... ...1 .... = Acknowledgment: Set
        .... .... 0... = Push: Not set
        .... .... .0.. = Reset: Not set
        .... .... ..0. = Syn: Not set
        .... .... ...0 = Fin: Not set
        [TCP Flags: ·······A····]
    Window: 512
    [Calculated window size: 65536]
    [Window size scaling factor: 128]
    Checksum: 0xfe28 [unverified]
    [Checksum Status: Unverified]
    Urgent Pointer: 0
    Options: (12 bytes), No-Operation (NOP), No-Operation (NOP), Timestamps
        TCP Option - No-Operation (NOP)
            Kind: No-Operation (1)
        TCP Option - No-Operation (NOP)
            Kind: No-Operation (1)
        TCP Option - Timestamps
            Kind: Time Stamp Option (8)
            Length: 10
            Timestamp value: 2188730761: TSval 2188730761, TSecr 2188730761
            Timestamp echo reply: 2188730761
    [Timestamps]
        [Time since first frame in this TCP stream: 0.001426926 seconds]
        [Time since previous frame in this TCP stream: 0.000012799 seconds]
    [SEQ/ACK analysis]
        [This is an ACK to the segment in frame: 4]
        [The RTT to ACK the segment was: 0.000012799 seconds]
        [iRTT: 0.000046580 seconds]

Frame 6: 107 bytes on wire (856 bits), 107 bytes captured (856 bits) on interface lo, id 0
    Section number: 1
    Interface id: 0 (lo)
        Interface name: lo
    Encapsulation type: Ethernet (1)
    Arrival Time: Nov 21, 2023 22:28:39.739830301 -03
    [Time shift for this packet: 0.000000000 seconds]
    Epoch Time: 1700616519.739830301 seconds
    [Time delta from previous captured frame: 0.009291268 seconds]
    [Time delta from previous displayed frame: 0.009291268 seconds]
    [Time since reference or first frame: 0.010718194 seconds]
    Frame Number: 6
    Frame Length: 107 bytes (856 bits)
    Capture Length: 107 bytes (856 bits)
    [Frame is marked: False]
    [Frame is ignored: False]
    [Protocols in frame: eth:ethertype:ip:tcp:ssh]
Ethernet II, Src: 00:00:00_00:00:00 (00:00:00:00:00:00), Dst: 00:00:00_00:00:00 (00:00:00:00:00:00)
    Destination: 00:00:00_00:00:00 (00:00:00:00:00:00)
        Address: 00:00:00_00:00:00 (00:00:00:00:00:00)
        .... ..0. .... .... .... .... = LG bit: Globally unique address (factory default)
        .... ...0 .... .... .... .... = IG bit: Individual address (unicast)
    Source: 00:00:00_00:00:00 (00:00:00:00:00:00)
        Address: 00:00:00_00:00:00 (00:00:00:00:00:00)
        .... ..0. .... .... .... .... = LG bit: Globally unique address (factory default)
        .... ...0 .... .... .... .... = IG bit: Individual address (unicast)
    Type: IPv4 (0x0800)
Internet Protocol Version 4, Src: 127.0.0.1, Dst: 127.0.0.1
    0100 .... = Version: 4
    .... 0101 = Header Length: 20 bytes (5)
    Differentiated Services Field: 0x00 (DSCP: CS0, ECN: Not-ECT)
        0000 00.. = Differentiated Services Codepoint: Default (0)
        .... ..00 = Explicit Congestion Notification: Not ECN-Capable Transport (0)
    Total Length: 93
    Identification: 0xa945 (43333)
    010. .... = Flags: 0x2, Don't fragment
        0... .... = Reserved bit: Not set
        .1.. .... = Don't fragment: Set
        ..0. .... = More fragments: Not set
    ...0 0000 0000 0000 = Fragment Offset: 0
    Time to Live: 64
    Protocol: TCP (6)
    Header Checksum: 0x9353 [validation disabled]
    [Header checksum status: Unverified]
    Source Address: 127.0.0.1
    Destination Address: 127.0.0.1
Transmission Control Protocol, Src Port: 22, Dst Port: 49928, Seq: 1, Ack: 42, Len: 41
    Source Port: 22
    Destination Port: 49928
    [Stream index: 0]
    [Conversation completeness: Incomplete, DATA (15)]
    [TCP Segment Len: 41]
    Sequence Number: 1    (relative sequence number)
    Sequence Number (raw): 3154420721
    [Next Sequence Number: 42    (relative sequence number)]
    Acknowledgment Number: 42    (relative ack number)
    Acknowledgment number (raw): 2205139371
    1000 .... = Header Length: 32 bytes (8)
    Flags: 0x018 (PSH, ACK)
        000. .... .... = Reserved: Not set
        ...0 .... .... = Accurate ECN: Not set
        .... 0... .... = Congestion Window Reduced: Not set
        .... .0.. .... = ECN-Echo: Not set
        .... ..0. .... = Urgent: Not set
        .... ...1 .... = Acknowledgment: Set
        .... .... 1... = Push: Set
        .... .... .0.. = Reset: Not set
        .... .... ..0. = Syn: Not set
        .... .... ...0 = Fin: Not set
        [TCP Flags: ·······AP···]
    Window: 512
    [Calculated window size: 65536]
    [Window size scaling factor: 128]
    Checksum: 0xfe51 [unverified]
    [Checksum Status: Unverified]
    Urgent Pointer: 0
    Options: (12 bytes), No-Operation (NOP), No-Operation (NOP), Timestamps
        TCP Option - No-Operation (NOP)
            Kind: No-Operation (1)
        TCP Option - No-Operation (NOP)
            Kind: No-Operation (1)
        TCP Option - Timestamps
            Kind: Time Stamp Option (8)
            Length: 10
            Timestamp value: 2188730770: TSval 2188730770, TSecr 2188730761
            Timestamp echo reply: 2188730761
    [Timestamps]
        [Time since first frame in this TCP stream: 0.010718194 seconds]
        [Time since previous frame in this TCP stream: 0.009291268 seconds]
    [SEQ/ACK analysis]
        [iRTT: 0.000046580 seconds]
        [Bytes in flight: 41]
        [Bytes sent since last PSH flag: 41]
    TCP payload (41 bytes)
SSH Protocol
    Protocol: SSH-2.0-OpenSSH_8.3p1 Ubuntu-1ubuntu0.1
    [Direction: server-to-client]

Frame 7: 66 bytes on wire (528 bits), 66 bytes captured (528 bits) on interface lo, id 0
    Section number: 1
    Interface id: 0 (lo)
        Interface name: lo
    Encapsulation type: Ethernet (1)
    Arrival Time: Nov 21, 2023 22:28:39.739834592 -03
    [Time shift for this packet: 0.000000000 seconds]
    Epoch Time: 1700616519.739834592 seconds
    [Time delta from previous captured frame: 0.000004291 seconds]
    [Time delta from previous displayed frame: 0.000004291 seconds]
    [Time since reference or first frame: 0.010722485 seconds]
    Frame Number: 7
    Frame Length: 66 bytes (528 bits)
    Capture Length: 66 bytes (528 bits)
    [Frame is marked: False]
    [Frame is ignored: False]
    [Protocols in frame: eth:ethertype:ip:tcp]
Ethernet II, Src: 00:00:00_00:00:00 (00:00:00:00:00:00), Dst: 00:00:00_00:00:00 (00:00:00:00:00:00)
    Destination: 00:00:00_00:00:00 (00:00:00:00:00:00)
        Address: 00:00:00_00:00:00 (00:00:00:00:00:00)
        .... ..0. .... .... .... .... = LG bit: Globally unique address (factory default)
        .... ...0 .... .... .... .... = IG bit: Individual address (unicast)
    Source: 00:00:00_00:00:00 (00:00:00:00:00:00)
        Address: 00:00:00_00:00:00 (00:00:00:00:00:00)
        .... ..0. .... .... .... .... = LG bit: Globally unique address (factory default)
        .... ...0 .... .... .... .... = IG bit: Individual address (unicast)
    Type: IPv4 (0x0800)
Internet Protocol Version 4, Src: 127.0.0.1, Dst: 127.0.0.1
    0100 .... = Version: 4
    .... 0101 = Header Length: 20 bytes (5)
    Differentiated Services Field: 0x00 (DSCP: CS0, ECN: Not-ECT)
        0000 00.. = Differentiated Services Codepoint: Default (0)
        .... ..00 = Explicit Congestion Notification: Not ECN-Capable Transport (0)
    Total Length: 52
    Identification: 0xf4f7 (62711)
    010. .... = Flags: 0x2, Don't fragment
        0... .... = Reserved bit: Not set
        .1.. .... = Don't fragment: Set
        ..0. .... = More fragments: Not set
    ...0 0000 0000 0000 = Fragment Offset: 0
    Time to Live: 64
    Protocol: TCP (6)
    Header Checksum: 0x47ca [validation disabled]
    [Header checksum status: Unverified]
    Source Address: 127.0.0.1
    Destination Address: 127.0.0.1
Transmission Control Protocol, Src Port: 49928, Dst Port: 22, Seq: 42, Ack: 42, Len: 0
    Source Port: 49928
    Destination Port: 22
    [Stream index: 0]
    [Conversation completeness: Incomplete, DATA (15)]
    [TCP Segment Len: 0]
    Sequence Number: 42    (relative sequence number)
    Sequence Number (raw): 2205139371
    [Next Sequence Number: 42    (relative sequence number)]
    Acknowledgment Number: 42    (relative ack number)
    Acknowledgment number (raw): 3154420762
    1000 .... = Header Length: 32 bytes (8)
    Flags: 0x010 (ACK)
        000. .... .... = Reserved: Not set
        ...0 .... .... = Accurate ECN: Not set
        .... 0... .... = Congestion Window Reduced: Not set
        .... .0.. .... = ECN-Echo: Not set
        .... ..0. .... = Urgent: Not set
        .... ...1 .... = Acknowledgment: Set
        .... .... 0... = Push: Not set
        .... .... .0.. = Reset: Not set
        .... .... ..0. = Syn: Not set
        .... .... ...0 = Fin: Not set
        [TCP Flags: ·······A····]
    Window: 512
    [Calculated window size: 65536]
    [Window size scaling factor: 128]
    Checksum: 0xfe28 [unverified]
    [Checksum Status: Unverified]
    Urgent Pointer: 0
    Options: (12 bytes), No-Operation (NOP), No-Operation (NOP), Timestamps
        TCP Option - No-Operation (NOP)
            Kind: No-Operation (1)
        TCP Option - No-Operation (NOP)
            Kind: No-Operation (1)
        TCP Option - Timestamps
            Kind: Time Stamp Option (8)
            Length: 10
            Timestamp value: 2188730770: TSval 2188730770, TSecr 2188730770
            Timestamp echo reply: 2188730770
    [Timestamps]
        [Time since first frame in this TCP stream: 0.010722485 seconds]
        [Time since previous frame in this TCP stream: 0.000004291 seconds]
    [SEQ/ACK analysis]
        [This is an ACK to the segment in frame: 6]
        [The RTT to ACK the segment was: 0.000004291 seconds]
        [iRTT: 0.000046580 seconds]

Frame 8: 1578 bytes on wire (12624 bits), 1578 bytes captured (12624 bits) on interface lo, id 0
    Section number: 1
    Interface id: 0 (lo)
        Interface name: lo
    Encapsulation type: Ethernet (1)
    Arrival Time: Nov 21, 2023 22:28:39.740038472 -03
    [Time shift for this packet: 0.000000000 seconds]
    Epoch Time: 1700616519.740038472 seconds
    [Time delta from previous captured frame: 0.000203880 seconds]
    [Time delta from previous displayed frame: 0.000203880 seconds]
    [Time since reference or first frame: 0.010926365 seconds]
    Frame Number: 8
    Frame Length: 1578 bytes (12624 bits)
    Capture Length: 1578 bytes (12624 bits)
    [Frame is marked: False]
    [Frame is ignored: False]
    [Protocols in frame: eth:ethertype:ip:tcp:ssh]
Ethernet II, Src: 00:00:00_00:00:00 (00:00:00:00:00:00), Dst: 00:00:00_00:00:00 (00:00:00:00:00:00)
    Destination: 00:00:00_00:00:00 (00:00:00:00:00:00)
        Address: 00:00:00_00:00:00 (00:00:00:00:00:00)
        .... ..0. .... .... .... .... = LG bit: Globally unique address (factory default)
        .... ...0 .... .... .... .... = IG bit: Individual address (unicast)
    Source: 00:00:00_00:00:00 (00:00:00:00:00:00)
        Address: 00:00:00_00:00:00 (00:00:00:00:00:00)
        .... ..0. .... .... .... .... = LG bit: Globally unique address (factory default)
        .... ...0 .... .... .... .... = IG bit: Individual address (unicast)
    Type: IPv4 (0x0800)
Internet Protocol Version 4, Src: 127.0.0.1, Dst: 127.0.0.1
    0100 .... = Version: 4
    .... 0101 = Header Length: 20 bytes (5)
    Differentiated Services Field: 0x00 (DSCP: CS0, ECN: Not-ECT)
        0000 00.. = Differentiated Services Codepoint: Default (0)
        .... ..00 = Explicit Congestion Notification: Not ECN-Capable Transport (0)
    Total Length: 1564
    Identification: 0xf4f8 (62712)
    010. .... = Flags: 0x2, Don't fragment
        0... .... = Reserved bit: Not set
        .1.. .... = Don't fragment: Set
        ..0. .... = More fragments: Not set
    ...0 0000 0000 0000 = Fragment Offset: 0
    Time to Live: 64
    Protocol: TCP (6)
    Header Checksum: 0x41e1 [validation disabled]
    [Header checksum status: Unverified]
    Source Address: 127.0.0.1
    Destination Address: 127.0.0.1
Transmission Control Protocol, Src Port: 49928, Dst Port: 22, Seq: 42, Ack: 42, Len: 1512
    Source Port: 49928
    Destination Port: 22
    [Stream index: 0]
    [Conversation completeness: Incomplete, DATA (15)]
    [TCP Segment Len: 1512]
    Sequence Number: 42    (relative sequence number)
    Sequence Number (raw): 2205139371
    [Next Sequence Number: 1554    (relative sequence number)]
    Acknowledgment Number: 42    (relative ack number)
    Acknowledgment number (raw): 3154420762
    1000 .... = Header Length: 32 bytes (8)
    Flags: 0x018 (PSH, ACK)
        000. .... .... = Reserved: Not set
        ...0 .... .... = Accurate ECN: Not set
        .... 0... .... = Congestion Window Reduced: Not set
        .... .0.. .... = ECN-Echo: Not set
        .... ..0. .... = Urgent: Not set
        .... ...1 .... = Acknowledgment: Set
        .... .... 1... = Push: Set
        .... .... .0.. = Reset: Not set
        .... .... ..0. = Syn: Not set
        .... .... ...0 = Fin: Not set
        [TCP Flags: ·······AP···]
    Window: 512
    [Calculated window size: 65536]
    [Window size scaling factor: 128]
    Checksum: 0x0411 [unverified]
    [Checksum Status: Unverified]
    Urgent Pointer: 0
    Options: (12 bytes), No-Operation (NOP), No-Operation (NOP), Timestamps
        TCP Option - No-Operation (NOP)
            Kind: No-Operation (1)
        TCP Option - No-Operation (NOP)
            Kind: No-Operation (1)
        TCP Option - Timestamps
            Kind: Time Stamp Option (8)
            Length: 10
            Timestamp value: 2188730771: TSval 2188730771, TSecr 2188730770
            Timestamp echo reply: 2188730770
    [Timestamps]
        [Time since first frame in this TCP stream: 0.010926365 seconds]
        [Time since previous frame in this TCP stream: 0.000203880 seconds]
    [SEQ/ACK analysis]
        [iRTT: 0.000046580 seconds]
        [Bytes in flight: 1512]
        [Bytes sent since last PSH flag: 1512]
    TCP payload (1512 bytes)
SSH Protocol
    SSH Version 2
        Packet Length: 1508
        Padding Length: 10
        Key Exchange
            Message Code: Key Exchange Init (20)
            Algorithms
                Cookie: c4afbb0ddb839c642478d3e171c4bfed
                kex_algorithms length: 241
                kex_algorithms string [truncated]: curve25519-sha256,curve25519-sha256@libssh.org,ecdh-sha2-nistp256,ecdh-sha2-nistp384,ecdh-sha2-nistp521,diffie-hellman-group-exchange-sha256,diffie-hellman-group16-sha512,diffie-hellman-group18-sha512,di
                server_host_key_algorithms length: 500
                server_host_key_algorithms string [truncated]: ecdsa-sha2-nistp256-cert-v01@openssh.com,ecdsa-sha2-nistp384-cert-v01@openssh.com,ecdsa-sha2-nistp521-cert-v01@openssh.com,sk-ecdsa-sha2-nistp256-cert-v01@openssh.com,ssh-ed25519-cert-v01@ope
                encryption_algorithms_client_to_server length: 108
                encryption_algorithms_client_to_server string: chacha20-poly1305@openssh.com,aes128-ctr,aes192-ctr,aes256-ctr,aes128-gcm@openssh.com,aes256-gcm@openssh.com
                encryption_algorithms_server_to_client length: 108
                encryption_algorithms_server_to_client string: chacha20-poly1305@openssh.com,aes128-ctr,aes192-ctr,aes256-ctr,aes128-gcm@openssh.com,aes256-gcm@openssh.com
                mac_algorithms_client_to_server length: 213
                mac_algorithms_client_to_server string [truncated]: umac-64-etm@openssh.com,umac-128-etm@openssh.com,hmac-sha2-256-etm@openssh.com,hmac-sha2-512-etm@openssh.com,hmac-sha1-etm@openssh.com,umac-64@openssh.com,umac-128@openssh.com,hmac-sha2-
                mac_algorithms_server_to_client length: 213
                mac_algorithms_server_to_client string [truncated]: umac-64-etm@openssh.com,umac-128-etm@openssh.com,hmac-sha2-256-etm@openssh.com,hmac-sha2-512-etm@openssh.com,hmac-sha1-etm@openssh.com,umac-64@openssh.com,umac-128@openssh.com,hmac-sha2-
                compression_algorithms_client_to_server length: 26
                compression_algorithms_client_to_server string: none,zlib@openssh.com,zlib
                compression_algorithms_server_to_client length: 26
                compression_algorithms_server_to_client string: none,zlib@openssh.com,zlib
                languages_client_to_server length: 0
                languages_client_to_server string: 
                languages_server_to_client length: 0
                languages_server_to_client string: 
                First KEX Packet Follows: 0
                Reserved: 00000000
                [hasshAlgorithms [truncated]: curve25519-sha256,curve25519-sha256@libssh.org,ecdh-sha2-nistp256,ecdh-sha2-nistp384,ecdh-sha2-nistp521,diffie-hellman-group-exchange-sha256,diffie-hellman-group16-sha512,diffie-hellman-group18-sha512,diffie-h]
                [hassh: ae8bd7dd09970555aa4c6ed22adbbf56]
        Padding String: 00000000000000000000
        Sequence number: 0
    [Direction: client-to-server]

Frame 9: 1122 bytes on wire (8976 bits), 1122 bytes captured (8976 bits) on interface lo, id 0
    Section number: 1
    Interface id: 0 (lo)
        Interface name: lo
    Encapsulation type: Ethernet (1)
    Arrival Time: Nov 21, 2023 22:28:39.740604729 -03
    [Time shift for this packet: 0.000000000 seconds]
    Epoch Time: 1700616519.740604729 seconds
    [Time delta from previous captured frame: 0.000566257 seconds]
    [Time delta from previous displayed frame: 0.000566257 seconds]
    [Time since reference or first frame: 0.011492622 seconds]
    Frame Number: 9
    Frame Length: 1122 bytes (8976 bits)
    Capture Length: 1122 bytes (8976 bits)
    [Frame is marked: False]
    [Frame is ignored: False]
    [Protocols in frame: eth:ethertype:ip:tcp:ssh]
Ethernet II, Src: 00:00:00_00:00:00 (00:00:00:00:00:00), Dst: 00:00:00_00:00:00 (00:00:00:00:00:00)
    Destination: 00:00:00_00:00:00 (00:00:00:00:00:00)
        Address: 00:00:00_00:00:00 (00:00:00:00:00:00)
        .... ..0. .... .... .... .... = LG bit: Globally unique address (factory default)
        .... ...0 .... .... .... .... = IG bit: Individual address (unicast)
    Source: 00:00:00_00:00:00 (00:00:00:00:00:00)
        Address: 00:00:00_00:00:00 (00:00:00:00:00:00)
        .... ..0. .... .... .... .... = LG bit: Globally unique address (factory default)
        .... ...0 .... .... .... .... = IG bit: Individual address (unicast)
    Type: IPv4 (0x0800)
Internet Protocol Version 4, Src: 127.0.0.1, Dst: 127.0.0.1
    0100 .... = Version: 4
    .... 0101 = Header Length: 20 bytes (5)
    Differentiated Services Field: 0x00 (DSCP: CS0, ECN: Not-ECT)
        0000 00.. = Differentiated Services Codepoint: Default (0)
        .... ..00 = Explicit Congestion Notification: Not ECN-Capable Transport (0)
    Total Length: 1108
    Identification: 0xa946 (43334)
    010. .... = Flags: 0x2, Don't fragment
        0... .... = Reserved bit: Not set
        .1.. .... = Don't fragment: Set
        ..0. .... = More fragments: Not set
    ...0 0000 0000 0000 = Fragment Offset: 0
